"Bug ID","Product","Component","Assignee","Status","Resolution","Summary","Changed"
46522,"JMeter","Main","issues","RESOLVED","FIXED","Incorrect ""Response data"" in JDBC sample when column names are missing","2009-01-24 05:00:48"
46524,"JMeter","Main","issues","RESOLVED","INVALID","JMeter (Java Management eXtension) Monitor","2009-01-30 11:04:07"
46560,"JMeter","HTTP","issues","RESOLVED","WORKSFORME","Can't record script in IE 6","2009-05-08 19:43:55"
46636,"JMeter","Main","issues","RESOLVED","FIXED","Allow server mode to optionally use a fixed rmi port","2009-05-10 07:55:44"
46651,"JMeter","Main","issues","RESOLVED","DUPLICATE","JDBC sample does not allow empty string(s) in prepare-SELECT statement - java-exception","2009-02-02 15:02:39"
46657,"JMeter","Main","issues","RESOLVED","DUPLICATE","provide an online PDF version of the User's Manual","2012-01-22 16:10:37"
46690,"JMeter","HTTP","issues","RESOLVED","FIXED","handling of 302 redirects with invalid relative paths","2009-04-03 04:36:01"
46761,"JMeter","Main","issues","RESOLVED","FIXED","New translations and corrections to French translations","2009-02-23 14:43:10"
46779,"JMeter","Main","issues","RESOLVED","DUPLICATE","${variable} expansion fails in listeners when running remote","2011-11-11 14:14:30"
46789,"JMeter","Main","issues","RESOLVED","WORKSFORME","Failed ""Response Assertion"" with multi ""Patterns to Test"" is pointing to incorrect pattern","2009-04-16 11:39:17"
46821,"JMeter","Main","issues","RESOLVED","FIXED","JDBC select request doesn't store the first column in the variables","2009-03-08 17:19:04"
46838,"JMeter","HTTP","issues","RESOLVED","FIXED","HTTP sampler will always set the latency to 0 if response contains no data","2009-04-03 02:43:24"
46844,"JMeter","Main","issues","RESOLVED","FIXED","""Library"" label in test plan are not I18N","2009-04-03 06:14:48"
46889,"JMeter","Main","issues","RESOLVED","DUPLICATE","Monitor thread busy is incorrect when server has more than one connector.","2009-03-23 02:57:26"
46899,"JMeter","Main","issues","RESOLVED","WONTFIX","Easy: fix suggested filename for ""Save Test Plan as""","2009-05-08 19:50:44"
46900,"JMeter","Main","issues","RESOLVED","FIXED","i18N: polish property file","2009-05-08 19:55:08"
46912,"JMeter","Main","issues","RESOLVED","FIXED","csv file corrupted","2010-02-07 16:00:56"
46921,"JMeter","Main","issues","RESOLVED","FIXED","Add Ability to Change Controller elements","2011-11-21 00:24:28"
46932,"JMeter","Main","issues","RESOLVED","FIXED","Alias given in select statement is not used as column header in response data for a JDBC request","2014-05-25 20:35:41"
46955,"JMeter","Main","issues","RESOLVED","INVALID","XML corrupt file when Monitoring a Server","2009-04-02 05:16:20"
46977,"JMeter","HTTP","issues","RESOLVED","FIXED","JMeter does not handle HTTP headers not delimited by whitespace","2009-05-12 21:57:12"
46993,"JMeter","Main","issues","RESOLVED","FIXED","Saving from Header Manager generates ClassCastException","2009-04-08 04:41:15"
47009,"JMeter","Main","issues","RESOLVED","FIXED","Lost of name's controller when insert a parent with same controller type","2009-04-23 16:19:02"
47015,"JMeter","Main","issues","RESOLVED","FIXED","Improve right panel length in French version","2009-04-16 10:36:26"
47016,"JMeter","Main","issues","RESOLVED","INVALID","BSF sampler with javascript doesn't return values","2009-04-13 16:56:54"
47033,"JMeter","HTTP","issues","RESOLVED","INVALID","HTTPS connection on VM-Ware on slx-cluster","2009-04-15 03:17:56"
47120,"JMeter","Main","issues","RESOLVED","FIXED","Throughput Controller: change percent executions to total executions, the value is stored in a String and interpreted as 1 execution","2009-04-30 18:29:23"
47127,"JMeter","Main","issues","RESOLVED","FIXED","Unable to change language to pl_PL","2009-04-30 04:51:44"
47132,"JMeter","Main","issues","RESOLVED","FIXED","Brazilian Portuguese translations","2009-05-05 07:32:32"
47137,"JMeter","Main","issues","RESOLVED","FIXED","Labels in View Results Tree aren't I18N","2009-05-01 14:21:43"
47165,"JMeter","HTTP","issues","RESOLVED","FIXED","Using the same module name in command line mode causes NPE","2013-08-07 09:10:05"
47166,"JMeter","Main","issues","RESOLVED","WONTFIX","Add render Flex AMF 3 (Action Message Format) to Listener View Results Tree","2012-03-19 02:05:48"
47176,"JMeter","Main","issues","RESOLVED","FIXED","Monitor Results : improve load status graphic","2009-05-09 06:56:05"
47223,"JMeter","Main","issues","RESOLVED","FIXED","Slow Aggregate Report Performance / org.apache.jorphan.math.StatCalculator","2009-08-18 09:23:40"
47266,"JMeter","Main","issues","RESOLVED","FIXED","FTP Request Sampler: allow specifying an FTP port, other than the default (21)","2009-06-16 17:10:20"
47269,"JMeter","Main","issues","RESOLVED","INVALID","StackOverflowException Using Combination of Random/Throughput/Module Controllers","2011-12-28 21:36:41"
47280,"JMeter","Main","issues","RESOLVED","FIXED","Unable to start jmeter on dutch XP","2010-08-17 12:54:05"
47288,"JMeter","Main","issues","RESOLVED","DUPLICATE","JMS samples use write id for correlation","2009-07-23 20:59:46"
47290,"JMeter","Main","issues","RESOLVED","FIXED","Infinite loop on connection factory lookup","2009-06-04 17:20:34"
47313,"JMeter","Main","issues","RESOLVED","FIXED","JMX file with Prepared Select Statement works in 2.3.2, fails in 2.3.3","2009-06-12 15:47:19"
47321,"JMeter","HTTP","issues","RESOLVED","FIXED","HTTPSampler2 response timeout not honored","2009-06-09 18:38:37"
47338,"JMeter","Main","issues","RESOLVED","FIXED","XPath Extractor forces retrieval of document DTD","2009-06-28 18:56:11"
47377,"JMeter","Main","issues","RESOLVED","FIXED","[Patch] Make ClassFinder more robust and close zipfile resources","2009-06-16 15:12:56"
47385,"JMeter","Main","issues","RESOLVED","FIXED","[Patch] TransactionController should set AllThreads and GroupThreads","2009-08-02 12:05:26"
47394,"JMeter","Main","issues","RESOLVED","FIXED","It should be easier to plug a custom SampleSender in jmeter","2009-06-19 19:15:49"
47398,"JMeter","Main","issues","RESOLVED","FIXED","[patch] SampleEvent are sent twice over RMI in distributed testing and non gui mode","2009-07-26 12:22:11"
47420,"JMeter","Main","issues","RESOLVED","FIXED","ldap extended request not closing connections during add request","2009-06-26 11:46:18"
47442,"JMeter","HTTP","issues","RESOLVED","FIXED","Missing replacement of https by http for certain conditions using https-spoofing","2009-08-11 08:38:00"
47445,"JMeter","HTTP","issues","RESOLVED","FIXED","Using Proxy with https-spoofing secure cookies need to be unsecured","2009-08-11 08:31:28"
47461,"JMeter","HTTP","issues","RESOLVED","FIXED","Update Cache Manager to handle Expires HTTP header","2012-07-09 15:02:25"
47474,"JMeter","Main","issues","RESOLVED","FIXED","View Results Tree support for plugin renderers","2009-12-01 12:34:16"
47534,"JMeter","Main","issues","RESOLVED","INVALID","Do Jmeter Supports Java script call..?","2009-07-20 14:52:56"
47551,"JMeter","Main","issues","RESOLVED","FIXED","Ctrl-H crashes JM-2.3.4","2009-07-22 06:42:58"
47556,"JMeter","Main","issues","RESOLVED","FIXED","JMS-PoinToPoint-Sampler Timout field should use Strings","2009-11-14 17:50:18"
47592,"JMeter","Main","issues","RESOLVED","FIXED","Run Thread groups consecutively with ""Stop test"" on error, JMeter will not mark to finished","2009-11-20 12:15:31"
47603,"JMeter","HTTP","issues","RESOLVED","INVALID","Connection Refused when open up 1000 http clients to reach a server url","2009-07-29 14:52:20"
47622,"JMeter","HTTP","issues","RESOLVED","FIXED","Allow JMeter Proxy to record HTTPS","2010-02-08 15:51:09"
47646,"JMeter","Main","issues","RESOLVED","FIXED","NullPointerException in the ""Random Variable"" element","2009-09-17 03:41:53"
47647,"JMeter","Main","issues","RESOLVED","DUPLICATE","Once Only Controller changes behavour inside another controller","2009-08-05 05:47:51"
47729,"JMeter","Main","issues","RESOLVED","INVALID","Webservices (SOAP) not sending in 2.3.4","2009-08-25 15:12:09"
47749,"JMeter","Main","issues","RESOLVED","INVALID","JMS Publisher cannot publish to a Topic and it hangs","2011-10-29 15:55:37"
47759,"JMeter","Main","issues","RESOLVED","WORKSFORME","GUI label fields sometimes truncated","2009-11-14 17:42:07"
47793,"JMeter","Main","issues","RESOLVED","INVALID","Javascript expression with tertiary operator and apostrophes fails","2009-09-07 10:24:31"
47803,"JMeter","Main","issues","RESOLVED","FIXED","Support for JUnit 4.x tests defined by annotations","2009-09-21 13:59:15"
47816,"JMeter","HTTP","issues","RESOLVED","INVALID","Invalid connection handling over threads","2009-09-10 09:30:14"
47817,"JMeter","HTTP","issues","RESOLVED","DUPLICATE","Use multiple connections per thread","2012-04-28 14:48:53"
47831,"JMeter","Main","issues","RESOLVED","INVALID","Jmeter crashed because of an unexpected error","2009-09-14 01:17:01"
47850,"JMeter","HTTP","issues","RESOLVED","WONTFIX","IncludeController : Not able to get the desired thread count / loop count","2011-11-15 15:31:20"
47857,"JMeter","HTTP","issues","RESOLVED","INVALID","if statement used in Beanshell Scripts","2009-10-28 03:58:01"
47865,"JMeter","Main","issues","RESOLVED","WONTFIX","New listeners optimized to work with huge amount of data and hight throughput and optimized DistributionGraph","2009-12-15 17:04:13"
47869,"JMeter","Main","issues","RESOLVED","FIXED","Ability to cleanup fields of SampleResult","2009-09-19 07:24:28"
47870,"JMeter","Main","issues","RESOLVED","FIXED","JMSSubscriber fails due to NPE","2009-09-24 09:22:46"
47886,"JMeter","Main","issues","RESOLVED","DUPLICATE","Use ThreadPool for threads rather than create/start() with delay","2012-09-28 14:05:41"
47888,"JMeter","Main","issues","RESOLVED","FIXED","JUnit Sampler re-uses test object","2011-09-21 12:28:35"
47890,"JMeter","Main","issues","RESOLVED","WONTFIX","WSDL data does not populate if web methods are too many.","2010-09-22 11:03:31"
47899,"JMeter","Main","issues","RESOLVED","FIXED","NullPointerExceptions in ReceiveSubscriber constructor","2009-09-30 09:36:57"
47900,"JMeter","Main","issues","RESOLVED","FIXED","Subscriber ThreadGroup won't stop","2009-11-03 06:21:29"
47907,"JMeter","Main","issues","RESOLVED","FIXED","Improvements (enhancements and I18N) Comparison Assertion and Comparison Visualizer","2009-11-14 13:58:39"
47909,"JMeter","Main","issues","RESOLVED","FIXED","[Patch] TransactionController should sum the latency","2009-11-14 15:29:55"
47915,"JMeter","Main","issues","RESOLVED","WORKSFORME","Always get OutOfMemoryError using JMS Topics","2010-02-07 15:56:53"
47921,"JMeter","Main","issues","RESOLVED","FIXED","Variables not released for GC after JMeterThread exits.","2011-09-17 21:51:14"
47938,"JMeter","Main","issues","RESOLVED","FIXED","Adding some French translations for new elements and some better meaning to other elements","2009-11-14 15:14:11"
47940,"JMeter","Main","issues","RESOLVED","FIXED","[Patch] Module controller incorrectly create the replacement Sub Tree","2009-11-14 15:25:07"
47943,"JMeter","Main","issues","RESOLVED","FIXED","[Patch] DisabledComponentRemover should die","2009-11-14 15:11:08"
47946,"JMeter","Main","issues","RESOLVED","FIXED","Proxy should enable Grouping inside a Transaction Controller","2009-11-20 11:10:38"
47947,"JMeter","Main","issues","RESOLVED","FIXED","Mail Reader Sampler should allow port to be overridden","2009-11-20 11:52:48"
47949,"JMeter","Main","issues","RESOLVED","FIXED","JMS Subscriber never recieves all the messages","2010-05-01 21:27:28"
47952,"JMeter","Main","issues","RESOLVED","FIXED","JSR-223 (ScriptEngine) support","2010-06-28 14:03:28"
47965,"JMeter","Main","issues","RESOLVED","INVALID","IF controller not waiting for responses","2009-10-08 09:11:17"
47980,"JMeter","Main","issues","RESOLVED","FIXED","hostname resolves to 127.0.0.1 - specifiying IP not possible","2009-11-14 15:03:16"
47992,"JMeter","Main","issues","RESOLVED","FIXED","JMS Point-to-Point Request - Response option doesn't work for me","2009-11-13 14:00:57"
48014,"JMeter","Main","issues","RESOLVED","WONTFIX","Groovy assertion, listener, pre/postproc, sampler","2009-10-22 17:13:05"
48015,"JMeter","Main","issues","RESOLVED","FIXED","Proposal new icons for pre-processor, post-processor and assertion elements","2010-08-31 17:18:21"
48016,"JMeter","Main","issues","RESOLVED","DUPLICATE","Suggested contribution: using jMeter in server mode over an SSH tunnel","2012-01-22 15:57:52"
48072,"JMeter","HTTP","issues","RESOLVED","WORKSFORME","Encoding of German  """"","2010-02-07 15:38:06"
48136,"JMeter","Main","issues","RESOLVED","FIXED","Essential files missing from source tarball","2010-01-09 10:07:39"
48144,"JMeter","Main","issues","RESOLVED","FIXED","NullPointer Exception in org.apache.jmeter.protocol.jms.client.OnMessageSubscriber initConnection()","2009-11-06 19:21:53"
48153,"JMeter","HTTP","issues","RESOLVED","FIXED","Support for Cache-Control and Expires headers","2009-11-17 11:38:00"
48155,"JMeter","Main","issues","RESOLVED","FIXED","Multiple problems / enhancements with JMS protocol classes.","2009-12-10 18:21:30"
48163,"JMeter","HTTP","issues","RESOLVED","FIXED","JMeterTestCase for org.apache.jmeter.protocol.http.control.CacheManager","2009-11-16 14:26:51"
48183,"JMeter","Main","issues","RESOLVED","FIXED","ant doesn't create build directory in download_jars task","2010-07-08 19:28:35"
48190,"JMeter","Main","issues","RESOLVED","DUPLICATE","Enh. Req.: Add simple text search feature to the View Results Tree, Response data tab.","2009-11-12 17:46:12"
48243,"JMeter","HTTP","issues","RESOLVED","INVALID","Credentials Fail to Load Periodically and Randomly","2009-11-20 04:13:11"
48259,"JMeter","Main","issues","RESOLVED","FIXED","Improve StatCalculator performance by using HashMap","2009-12-14 16:59:20"
48286,"JMeter","Main","issues","RESOLVED","INVALID","ConstantTimer's delay cannot be changed dynamically during a test","2009-11-25 23:54:36"
48300,"JMeter","HTTP","issues","RESOLVED","FIXED","Allow JMeter HTTP Request HTTPClient to use several source IP addresses (IP aliasing or network interfaces)","2009-11-30 16:48:13"
48331,"JMeter","Main","issues","RESOLVED","FIXED","XpathExtractor does not return XML string representations for a Nodeset","2009-12-15 07:22:51"
48348,"JMeter","HTTP","issues","RESOLVED","INVALID","JDBC Request Results clears HTTP URL Re-writing Modifiers and other variables","2009-12-08 08:46:15"
48350,"JMeter","Main","issues","RESOLVED","FIXED","Deadlock on distributed testing with 2 clients","2010-03-06 21:39:58"
48451,"JMeter","HTTP","issues","RESOLVED","FIXED","Error in: SoapSampler.setPostHeaders(PostMethod post) in the else branch","2009-12-29 19:16:57"
48452,"JMeter","HTTP","issues","RESOLVED","WONTFIX","parameterize arbitary generated binary file amf protocol","2010-01-21 08:46:22"
48463,"JMeter","Main","issues","RESOLVED","INVALID","Wrong output of 'label' field in jtl file","2009-12-30 03:40:26"
48479,"JMeter","Main","issues","RESOLVED","WORKSFORME","JMeter not recording file upload and download scenarios","2010-01-05 03:22:14"
48484,"JMeter","HTTP","issues","RESOLVED","INVALID","how can i write my own .jmx scripts for mywebportal","2010-01-05 03:17:21"
48487,"JMeter","Main","issues","RESOLVED","INVALID","Method JavaSamplerContext.getParameterNamesIterator return iterator with wrong number of elements","2010-01-21 08:55:18"
48511,"JMeter","Main","issues","RESOLVED","FIXED","add parent,child,all selection to regex extractor panel","2010-01-30 15:25:52"
48542,"JMeter","HTTP","issues","RESOLVED","FIXED","SoapSampler uses wrong response header field to decide if response is gzip encoded","2010-01-14 06:13:05"
48556,"JMeter","Main","issues","RESOLVED","WONTFIX","xpath function which name has ""-"" is not supported in xpath assertion","2010-01-21 08:41:11"
48568,"JMeter","HTTP","issues","RESOLVED","FIXED","CookieManager broken for AjpSampler","2010-01-18 17:19:01"
48570,"JMeter","HTTP","issues","RESOLVED","FIXED","AjpSampler doesn't support query parameters (GET/POST)","2010-01-21 06:46:47"
48573,"JMeter","Main","issues","RESOLVED","FIXED","LDAPExtSampler directory context handling","2010-01-20 15:52:21"
48579,"JMeter","Main","issues","RESOLVED","FIXED","[PATCH] Single Bind does not show config information when LdapExt Sampler is accessed","2010-01-20 17:52:19"
48603,"JMeter","Main","issues","RESOLVED","FIXED","Mailer Visualiser sends two emails for a single failed response","2010-01-24 09:22:35"
48650,"JMeter","HTTP","issues","RESOLVED","INVALID","No response is visible","2010-02-15 13:13:54"
48709,"JMeter","Main","issues","RESOLVED","FIXED","TCP Sampler Config setting ""classname"" has no effect","2010-06-28 15:08:25"
48714,"JMeter","Main","issues","RESOLVED","FIXED","add new French messages","2010-02-16 23:34:07"
48727,"JMeter","Main","issues","RESOLVED","FIXED","Cannot stop test if all thread groups are disabled","2010-02-23 16:40:11"
48728,"JMeter","Main","issues","RESOLVED","FIXED","HTTPS SOAP requests unable to open connection","2010-02-15 13:14:47"
48747,"JMeter","Main","issues","RESOLVED","FIXED","TCP Sampler swallows exception samples","2010-02-16 15:22:23"
48749,"JMeter","Main","issues","RESOLVED","FIXED","Allowing custom Thread Groups","2010-03-10 07:28:49"
48753,"JMeter","HTTP","issues","RESOLVED","FIXED","CookieManager is not available when run with jdk 1.6.0_13","2010-02-17 19:04:43"
48762,"JMeter","HTTP","issues","RESOLVED","WONTFIX","Warning: Constant Timer was interrupted","2010-02-23 16:44:04"
48786,"JMeter","Main","issues","RESOLVED","FIXED","Run Thread groups consecutively: with ""Stop test now"" on error or manual stop, JMeter leaves the green box active","2010-02-23 16:20:10"
48794,"JMeter","Main","issues","RESOLVED","WORKSFORME","Jmeter 2.3.4r785646. Parameters doesn't put into the Get requiest","2010-11-27 07:10:24"
48799,"JMeter","Main","issues","RESOLVED","FIXED","Add connect time to output metrics","2015-02-25 07:06:33"
48874,"JMeter","Main","issues","RESOLVED","INVALID","let jmeter proxy add user delays","2011-12-31 16:55:00"
48878,"JMeter","Main","issues","RESOLVED","WONTFIX","OutOfMemory during endurance testing","2010-07-08 19:24:11"
48883,"JMeter","Main","issues","RESOLVED","FIXED","Corrections for AbstractThreadGroup","2010-03-11 09:48:42"
48889,"JMeter","Main","issues","RESOLVED","FIXED","Wrong response time with mode=Statistical and num_sample_threshold > 1","2010-03-11 23:40:11"
48897,"JMeter","HTTP","issues","RESOLVED","DUPLICATE","export imeter test plans from websarab","2010-03-12 14:52:01"
48898,"JMeter","HTTP","issues","RESOLVED","WONTFIX","export imeter test plans from webscarab","2012-03-19 20:17:24"
48901,"JMeter","HTTP","issues","RESOLVED","FIXED","Endless wait by adding Synchronizing Timer","2010-03-15 18:23:24"
48945,"JMeter","Main","issues","RESOLVED","INVALID","Generate Summary Results outputs one or more summaries","2010-03-19 17:16:46"
49039,"JMeter","HTTP","issues","RESOLVED","DUPLICATE","Proxy : Bug with multipart bytes","2012-06-27 21:17:24"
49054,"JMeter","Main","issues","RESOLVED","INVALID","Throughput Controller not functioning as expected","2010-04-06 16:17:23"
49069,"JMeter","Main","issues","RESOLVED","INVALID","jmx file opening error in jmeter","2010-04-08 12:59:13"
49083,"JMeter","HTTP","issues","RESOLVED","FIXED","collapse '/..' in redirect URLs","2010-07-01 18:40:07"
49084,"JMeter","Main","issues","RESOLVED","INVALID","Response Assertion failing for certain strings","2010-04-09 17:59:28"
49111,"JMeter","Main","issues","RESOLVED","FIXED","""Message With ID Not Found"" Error on JMS P2P sampler when NOT Use non-persistent delivery mode","2010-06-25 19:23:01"
49149,"JMeter","Main","issues","RESOLVED","FIXED","usermanual/index.html has typo in link to ""Regular Expressions"" page","2010-04-19 10:30:52"
49174,"JMeter","Main","issues","RESOLVED","INVALID","Can't load response data from a listener if double byte includes in data","2010-04-28 10:21:54"
49208,"JMeter","Main","issues","RESOLVED","WORKSFORME","Double byte code is garbled when reading from result file","2011-10-30 16:27:31"
49223,"JMeter","HTTP","issues","RESOLVED","DUPLICATE","Parameters do not work in the ""Send Files with the Request"" Field","2010-04-29 11:04:24"
49294,"JMeter","HTTP","issues","RESOLVED","FIXED","Images not downloaded from redirected-to pages","2010-05-14 20:47:39"
49321,"JMeter","Main","issues","RESOLVED","DUPLICATE","Left panel is very long with blank space","2010-05-21 06:05:10"
49336,"JMeter","Main","issues","RESOLVED","INVALID","JMeter throws Out of memory error during Endurance testing(prolonged test run)","2010-05-25 10:59:25"
49365,"JMeter","Main","issues","RESOLVED","FIXED","Allow result set to be written to file in a path relative to the loaded script","2010-10-28 18:02:41"
49374,"JMeter","HTTP","issues","RESOLVED","FIXED","Encoding of embedded element URLs depend on the file.encoding property","2011-12-28 14:34:37"
49394,"JMeter","Main","issues","RESOLVED","FIXED","Classcast Exception in ActionRouter.postActionPerformed","2010-08-17 12:51:35"
49462,"JMeter","HTTP","issues","RESOLVED","FIXED","Cookie Manager Not Incrementing As Expected","2011-09-18 09:31:04"
49463,"JMeter","Main","issues","RESOLVED","DUPLICATE","Reference Name in Counter is not Incrementing","2011-12-28 21:20:13"
49482,"JMeter","Main","issues","RESOLVED","FIXED","JMS Queue Receiver","2010-07-05 08:38:11"
49486,"JMeter","Main","issues","RESOLVED","FIXED","JMS Receiver Source Patch","2010-07-06 12:36:10"
49506,"JMeter","Main","issues","RESOLVED","FIXED","Add .csv File Extension in open dialog box from ""read from file"" functionality of listeners","2010-06-25 15:19:07"
49537,"JMeter","HTTP","issues","RESOLVED","INVALID","Got exceptions while recording upload file use JMeter","2010-07-08 19:23:03"
49540,"JMeter","Main","issues","RESOLVED","FIXED","Sort ""Add"" menus alphabetically","2010-07-02 05:42:11"
49545,"JMeter","Main","issues","RESOLVED","FIXED","Formatted (parsed) view of Sample Result in Results Tree","2010-07-07 20:44:07"
49552,"JMeter","Main","issues","RESOLVED","FIXED","Add Message Headers on SMTPSampler","2010-07-06 12:19:26"
49560,"JMeter","HTTP","issues","RESOLVED","FIXED","wrong ""size in bytes"" when following redirections","2010-07-08 11:41:41"
49573,"JMeter","Main","issues","RESOLVED","FIXED","French translations for new elements (SMTP, assert. MIME, BSF, etc), others (JMS) and some improvements","2010-07-08 17:18:44"
49601,"JMeter","HTTP","issues","RESOLVED","WORKSFORME","NTLM Auth problem using HTTPClient 3.1 implementation","2012-01-14 13:38:09"
49603,"JMeter","Main","issues","RESOLVED","FIXED","Allow accepting expired certificates on Mail Reader Sampler","2010-08-16 18:20:14"
49622,"JMeter","Main","issues","RESOLVED","FIXED","Allow sending messages without a subject","2010-08-16 16:58:45"
49626,"JMeter","Main","issues","RESOLVED","WORKSFORME","Mail Reader Sampler is not able to connect to pop server","2010-08-19 12:39:21"
49666,"JMeter","Main","issues","RESOLVED","FIXED","CSV Header read as data after EOF","2013-01-08 17:29:37"
49734,"JMeter","Main","issues","RESOLVED","FIXED","Null pointer exception on stop Threads command (Run>Stop)","2010-11-16 05:12:28"
49753,"JMeter","Main","issues","RESOLVED","FIXED","Please publish jMeter artifacts on Maven central repository","2012-01-19 14:14:57"
49858,"JMeter","Main","issues","RESOLVED","WORKSFORME","server mode should try binding to an existing registry","2010-09-03 03:00:52"
49904,"JMeter","Main","issues","RESOLVED","INVALID","Performance problem : I cann't use Jmeter to simulate stress enough","2010-09-18 21:10:56"
49906,"JMeter","HTTP","issues","RESOLVED","WONTFIX","Jmeter retrieves more elements than expected in one request","2010-09-10 13:36:52"
49950,"JMeter","HTTP","issues","RESOLVED","FIXED","Proxy : IndexOutOfBoundsException when recording with Proxy server","2011-12-30 12:40:38"
49975,"JMeter","Main","issues","RESOLVED","FIXED","New function returning the name of the current sampler","2011-04-20 08:35:37"
49976,"JMeter","HTTP","issues","RESOLVED","FIXED","FormCharSetFinder visibility is default instead of public.","2011-09-27 15:07:05"
50008,"JMeter","Main","issues","RESOLVED","FIXED","Enhancement : Make BatchSampleSender constructor protected instead of package protected","2010-10-21 09:01:05"
50009,"JMeter","Main","issues","RESOLVED","INVALID","Enrich save service with JMeter JVM identifier","2010-09-27 09:04:10"
50079,"JMeter","HTTP","issues","RESOLVED","INVALID","Jmeter does not record the file path","2010-10-12 08:15:57"
50080,"JMeter","Main","issues","RESOLVED","FIXED","Transaction controller incorrectly creates samples including timer duration","2010-10-28 15:14:39"
50086,"JMeter","Main","issues","RESOLVED","FIXED","Password fields not Hidden in JMS Publisher, JMS Subscriber, Mail Reader sampler, SMTP sampler and Database Configuration","2011-12-04 15:55:19"
50088,"JMeter","Main","issues","RESOLVED","FIXED","getAvgPageBytes in SamplingStatCalculator does not what it says","2010-10-21 09:26:03"
50097,"JMeter","HTTP","issues","RESOLVED","FIXED","Failed Transaction does not show up in JTL file when Action is Stop thread","2010-10-17 08:06:35"
50134,"JMeter","Main","issues","RESOLVED","FIXED","TransactionController : Reports bad response time when it contains other TransactionControllers","2010-11-01 13:01:39"
50148,"JMeter","Main","issues","RESOLVED","INVALID","JMeter UI freezes on startup","2010-10-28 15:42:51"
50170,"JMeter","HTTP","issues","RESOLVED","FIXED","Bytes reported by http sampler is after GUnZip","2011-04-04 15:36:44"
50173,"JMeter","Main","issues","RESOLVED","FIXED","JDBCSampler discards ResultSet from a PreparedStatement.","2010-10-28 18:14:00"
50178,"JMeter","HTTP","issues","RESOLVED","FIXED","HeaderManager added as child of Thread Group can create concatenated HeaderManager names and OutOfMemoryException","2010-10-29 19:53:08"
