"Bug ID","Product","Component","Assignee","Status","Resolution","Summary","Changed"
57447,"JMeter","HTTP","issues","RESOLVED","FIXED","DNS Cache Manager always reads in resolv.config when using custom DNS resolver","2015-01-24 19:54:47"
57449,"JMeter","Main","issues","RESOLVED","FIXED","Distributed Testing: Stripped modes do not strip responses from SubResults (affects load tests that use Download of embedded resources)","2015-01-16 17:02:08"
57466,"JMeter","Main","issues","RESOLVED","FIXED","IncludeController : Remove an unneeded set creation","2015-01-23 22:57:44"
57488,"JMeter","HTTP","issues","RESOLVED","FIXED","Performance : Improve SSLContext reset for Two-way SSL Authentication","2015-01-23 22:48:40"
57500,"JMeter","Main","issues","RESOLVED","FIXED","Introduce retry behavior for remote testing","2015-01-30 11:52:47"
57514,"JMeter","Main","issues","RESOLVED","FIXED","Aggregate Graph, Summary Report and Aggregate Report show wrong percentage reporting in saved file","2015-02-15 15:27:02"
57518,"JMeter","Main","issues","RESOLVED","FIXED","Icons for toolbar with several sizes","2015-01-31 17:55:22"
57537,"JMeter","Main","issues","RESOLVED","FIXED","BackendListener : Allow implementations to drop samples","2015-02-04 22:16:47"
57555,"JMeter","Main","issues","RESOLVED","FIXED","Cannot use JMeter 2.12 as a maven dependency","2015-02-28 16:39:44"
57562,"JMeter","Main","issues","RESOLVED","FIXED","View Results Tree CSS/JQuery Tester : Nothing happens when there is an error in syntax and an exception occurs in jmeter.log","2015-02-10 21:09:01"
57565,"JMeter","Main","issues","RESOLVED","FIXED","SamplerCreator : Add method to allow implementations to add children to created sampler","2015-02-11 07:39:57"
57567,"JMeter","Main","issues","RESOLVED","INVALID","JSR223 javascript misbehave on OpenJDK","2015-02-15 15:36:33"
57569,"JMeter","Main","issues","RESOLVED","FIXED","FileServer.reserveFile - inconsistent behaviour when hasHeader is true","2015-02-11 20:09:11"
57579,"JMeter","HTTP","issues","RESOLVED","FIXED","NullPointerException error is raised on main sample if ""RETURN_NO_SAMPLE"" is used (default) and ""Use Cache-Control / Expires header..."" is checked in HTTP Cache Manager","2015-02-15 13:32:07"
57613,"JMeter","HTTP","issues","RESOLVED","FIXED","HTTP Sampler : Added CalDAV verbs (REPORT, MKCALENDAR)","2015-02-23 03:41:55"
57648,"JMeter","Main","issues","RESOLVED","FIXED","TestFragment should be disabled when created","2015-02-28 20:31:05"
57649,"JMeter","Main","issues","RESOLVED","DUPLICATE","Missing dependencies in the maven project","2015-02-28 16:39:44"
57656,"JMeter","Main","issues","RESOLVED","DUPLICATE","__regexFunction doesn't works in remote testing with MODE_STRIPPED_BATCH","2015-03-03 20:42:17"
57657,"JMeter","Main","issues","RESOLVED","INVALID","responce data","2015-03-03 20:34:29"
57658,"JMeter","HTTP","issues","RESOLVED","INVALID","responce data","2015-03-05 13:36:23"
57663,"JMeter","Main","issues","RESOLVED","INVALID","JMS point-to-point sampler: Selector field doesn't replace the beanshell preprocessor variables","2015-03-05 13:37:48"
57682,"JMeter","HTTP","issues","RESOLVED","WORKSFORME","Windows 8.1 - java.net.SocketException: Permission denied: connect","2015-03-22 14:39:13"
57688,"JMeter","Main","issues","RESOLVED","WORKSFORME","Impossibility to save the ""Sample Result Save Configuration"" from GUI","2015-03-12 15:36:06"
57696,"JMeter","HTTP","issues","RESOLVED","FIXED","HTTP Request : Improve responseMessage when resource download fails","2015-03-22 17:46:30"
57698,"JMeter","Main","issues","RESOLVED","WONTFIX","SOAP/XML-RPC data not formatted as XML","2015-03-13 20:54:27"
57713,"JMeter","Main","issues","RESOLVED","WONTFIX","Cannot choose samplers from workbench in Module Controller","2015-03-16 07:00:46"
57716,"JMeter","Main","issues","RESOLVED","DUPLICATE","Log viewer undo memory leak","2015-03-16 19:57:39"
57734,"JMeter","Main","issues","RESOLVED","FIXED","Maven transient dependencies are incorrect for 2.13","2015-03-26 02:32:03"
57748,"JMeter","Main","issues","RESOLVED","DUPLICATE","The dependency on math3 and pool2 are wrong in Jmeter pom","2015-03-24 12:56:16"
57754,"JMeter","Main","issues","RESOLVED","INVALID","Unable to capture http traffic for Login (through ADFS) on Web App while Recording with Jmeter","2015-03-25 21:07:48"
57792,"JMeter","Main","issues","RESOLVED","FIXED","Change links to bugzilla to bz.apache.org","2015-04-06 13:04:01"
57793,"JMeter","Main","issues","RESOLVED","FIXED","Omit expected error message in test run","2015-04-04 19:12:13"
57794,"JMeter","HTTP","issues","RESOLVED","INVALID","dg chjk","2015-04-06 06:33:58"
4470,"JMeter","Main","issues","RESOLVED","FIXED","Menus are displayed twice","2005-03-20 17:06:12"
5658,"JMeter","Main","issues","RESOLVED","FIXED","Out of memory when running the proxy","2004-11-16 19:05:38"
6730,"JMeter","Main","issues","RESOLVED","FIXED","Transactions","2004-11-16 19:05:38"
7378,"JMeter","Main","issues","RESOLVED","WONTFIX","HTTP Proxy Server doesn't do ""https""","2008-05-29 02:35:14"
8007,"JMeter","Main","issues","RESOLVED","FIXED","JMeter 1.7. Can`t open saved testplans","2005-03-20 17:06:12"
9101,"JMeter","Main","issues","RESOLVED","FIXED","Make a default GUI Test Element object","2005-03-20 17:06:12"
11422,"JMeter","Main","issues","RESOLVED","FIXED","JMeter should record results during proxy recording","2006-04-26 15:07:22"
11843,"JMeter","Main","issues","RESOLVED","WONTFIX","Relay to Browser","2006-04-26 15:08:40"
12144,"JMeter","Main","issues","RESOLVED","FIXED","Need a way to stop a test plan","2005-09-25 17:44:47"
12220,"JMeter","HTTP","issues","RESOLVED","FIXED","Problem expanding multiple JMeter ${} in Path of HTTP Request","2005-03-20 17:06:12"
12314,"JMeter","Main","issues","RESOLVED","FIXED","Rationalize Timer GUIs","2004-11-16 19:05:39"
12336,"JMeter","Main","issues","RESOLVED","FIXED","wrong time in first ""Sample -ms""","2005-03-20 17:06:12"
12970,"JMeter","Main","issues","RESOLVED","FIXED","Loading medium to large test plans is slow","2004-11-16 19:05:39"
13147,"JMeter","HTTP","issues","RESOLVED","INVALID","Timer Controller","2004-11-16 19:05:39"
13179,"JMeter","HTTP","issues","RESOLVED","WORKSFORME","Can't seem to get the HTTP HTML Link Parser to work...","2005-03-20 17:06:12"
13452,"JMeter","Main","issues","RESOLVED","FIXED","Test cases with 50K Http requests won't load","2004-11-16 19:05:39"
13750,"JMeter","HTTP","issues","RESOLVED","FIXED","JMeter does not pass Cookies to a redirected URL","2005-03-20 17:06:12"
14088,"JMeter","HTTP","issues","RESOLVED","WONTFIX","gzip compression","2004-11-16 19:05:39"
14533,"JMeter","HTTP","issues","RESOLVED","FIXED","Can't use ${vars} in SOAP/XML request URL","2004-11-16 19:05:39"
14762,"JMeter","HTTP","issues","RESOLVED","FIXED","Enhancement: ""Assertion defaults"" - component would be useful","2004-11-16 19:05:39"
14937,"JMeter","HTTP","issues","RESOLVED","INVALID","Need ability to extract parameters from HTML pages to support dynamic pages","2005-03-20 17:06:12"
15025,"JMeter","Main","issues","RESOLVED","FIXED","Need ability to store Session ID","2006-04-26 17:10:35"
15027,"JMeter","Main","issues","RESOLVED","FIXED","Extract values from cookies","2004-11-16 19:05:39"
15236,"JMeter","HTTP","issues","RESOLVED","FIXED","Help System Links are broken","2004-11-16 19:05:39"
15334,"JMeter","HTTP","issues","RESOLVED","WONTFIX","Modifiers","2005-03-20 17:06:12"
15412,"JMeter","Main","issues","RESOLVED","FIXED","SizeAssertion doesn't allow assertions other than equality","2004-11-16 19:05:40"
15468,"JMeter","HTTP","issues","RESOLVED","WONTFIX","Variable expansion in posted files in HTTPSampler","2013-12-19 21:51:00"
15826,"JMeter","Main","issues","RESOLVED","FIXED","New Test Component type: Extractors","2004-11-16 19:05:40"
16050,"JMeter","Main","issues","RESOLVED","FIXED","jtl files need to be in a format more suitable to fast loading","2005-03-20 17:06:12"
16051,"JMeter","Main","issues","RESOLVED","FIXED","Save should store disabled status of test elements","2005-03-20 17:06:12"
16052,"JMeter","Main","issues","RESOLVED","LATER","An option to disable timers should be provided","2007-06-05 04:15:54"
16053,"JMeter","Main","issues","RESOLVED","FIXED","HTTP Requests for images should provide a rendering mechanism","2005-03-20 17:06:12"
16059,"JMeter","Main","issues","RESOLVED","WONTFIX","FunctionHelper should use classpath rather than lib/ext","2005-03-20 17:06:12"
16060,"JMeter","Main","issues","RESOLVED","FIXED","HTTP Request Retrieve all images option does not mimic cache","2008-10-02 08:21:54"
16163,"JMeter","Main","issues","RESOLVED","WONTFIX","SOAP/XML-RPC request URL defaults","2012-11-25 15:31:31"
16304,"JMeter","HTTP","issues","RESOLVED","FIXED","ConcurrentModificationException","2004-11-16 19:05:40"
16314,"JMeter","Main","issues","RESOLVED","FIXED","MailerVisualizer works only in GUI-mode","2004-11-16 19:05:40"
16370,"JMeter","HTTP","issues","RESOLVED","WONTFIX","HTTP Request log","2013-08-25 21:02:48"
16553,"JMeter","HTTP","issues","RESOLVED","FIXED","Remote Start not connecting","2004-11-16 19:05:40"
16554,"JMeter","HTTP","issues","RESOLVED","FIXED","Linux Client to Linux Remote Server","2004-11-16 19:05:40"
16725,"JMeter","Main","issues","RESOLVED","WORKSFORME","Assertion Results component should allow for less verbose output","2005-03-20 17:06:12"
16886,"JMeter","HTTP","issues","RESOLVED","WONTFIX","Recorded requests shouldn't duplicate info in HTTP Request Defaults","2013-01-01 17:48:53"
16917,"JMeter","Main","issues","RESOLVED","FIXED","printable_docs does not work","2004-11-16 19:05:40"
16947,"JMeter","Main","issues","RESOLVED","FIXED","Error in printable_docs build.xml target","2004-11-16 19:05:40"
17038,"JMeter","Main","issues","RESOLVED","FIXED","Remote Start All","2004-11-16 19:05:40"
17249,"JMeter","Main","issues","RESOLVED","WONTFIX","JMeter should indicate resource constraint problems","2005-03-20 17:06:12"
17300,"JMeter","HTTP","issues","RESOLVED","FIXED","Log Replay","2004-11-16 19:05:40"
17476,"JMeter","Main","issues","RESOLVED","FIXED","Erroneous HTTP requests generated with more than 1 thread on JDK1.3.1","2004-11-16 19:05:40"
17478,"JMeter","Main","issues","RESOLVED","WORKSFORME","Inaccurate time measurements","2004-11-16 19:05:40"
17558,"JMeter","HTTP","issues","RESOLVED","WORKSFORME","Enhancement request","2004-11-16 19:05:40"
17688,"JMeter","Main","issues","RESOLVED","FIXED","ConstantThroughputTimer does not work in non-GUI (batch) mode","2004-11-16 19:05:40"
17737,"JMeter","HTTP","issues","RESOLVED","FIXED","jmeter log - java.lang.ArrayIndexOutOfBoundsException","2015-03-26 11:35:09"
17843,"JMeter","Main","issues","RESOLVED","FIXED","need an option to set a time period for the Jmeter  test run","2004-11-16 19:05:40"
17942,"JMeter","Main","issues","RESOLVED","FIXED","JMeter requires Java1.4/Doc states java1.2","2004-11-16 19:05:40"
18009,"JMeter","HTTP","issues","RESOLVED","FIXED","Allow multiple send parameter values from file input","2004-11-16 19:05:40"
18070,"JMeter","Main","issues","RESOLVED","FIXED","Would Like Dynamic linking of .jmx files","2006-05-22 14:55:19"
18158,"JMeter","Main","issues","RESOLVED","FIXED","Incorrect long option name for -n","2004-11-16 19:05:40"
18160,"JMeter","Main","issues","RESOLVED","FIXED","SaveService always uses jmeter.properties","2004-11-16 19:05:40"
18178,"JMeter","HTTP","issues","RESOLVED","FIXED","HTTP Sampler leaks connections in keep-alive","2004-11-16 19:05:40"
18195,"JMeter","Main","issues","RESOLVED","FIXED","Agregate Report not using Name for JDBC Requests","2004-11-16 19:05:40"
18211,"JMeter","HTTP","issues","RESOLVED","INVALID","java.net.UnknownHostException: /axis/aa.html . Error hostname in Http Proxy Recording.","2004-11-16 19:05:40"
18213,"JMeter","Main","issues","RESOLVED","FIXED","StringFromFile keeps returning first record","2004-11-16 19:05:40"
18306,"JMeter","Main","issues","RESOLVED","FIXED","Configuration value is not refelected in FTPSampler","2004-11-16 19:05:40"
18353,"JMeter","Main","issues","RESOLVED","FIXED","CSV results file format not working","2004-11-16 19:05:40"
18356,"JMeter","Main","issues","RESOLVED","FIXED","unexpected behaviour in save on exit dialog","2004-11-16 19:05:40"
18358,"JMeter","HTTP","issues","RESOLVED","WONTFIX","HTTP Request creation enhancements","2004-11-16 19:05:40"
18359,"JMeter","HTTP","issues","RESOLVED","FIXED","URL encoding error with elements that parse the http response","2006-04-17 14:40:39"
18367,"JMeter","Main","issues","RESOLVED","FIXED","Can not provide jks-keystore password in server mode","2004-11-16 19:05:40"
18407,"JMeter","HTTP","issues","RESOLVED","FIXED","Delete row in ResponseAssessiongui throws ArrayIndexOutOfBoundsException","2004-11-16 19:05:40"
18418,"JMeter","HTTP","issues","RESOLVED","WORKSFORME","Cookie not attached to request","2005-03-20 17:06:12"
18503,"JMeter","Main","issues","RESOLVED","FIXED","[PATCH] Resizing issues","2004-11-16 19:05:40"
18560,"JMeter","HTTP","issues","RESOLVED","FIXED","In the CookiePanel  rows gets added automatically","2004-11-16 19:05:40"
18589,"JMeter","Main","issues","RESOLVED","FIXED","IP numbers numbers need to be 'trimmed of spaces'","2004-11-16 19:05:40"
18697,"JMeter","Main","issues","RESOLVED","WORKSFORME","Problem in starting up JMeter","2005-03-20 17:06:12"
18724,"JMeter","HTTP","issues","RESOLVED","FIXED","Follow Redirects still shows error after redirect","2004-11-16 19:05:40"
18743,"JMeter","Main","issues","RESOLVED","FIXED","SSLManagerCommand and SSLManager property settings","2004-11-16 19:05:40"
18844,"JMeter","Main","issues","RESOLVED","FIXED","HTTP Proxy Server always records server, port and path","2005-03-20 17:06:12"
18845,"JMeter","HTTP","issues","RESOLVED","FIXED","Assert HTTP Response code","2004-11-16 19:05:40"
18851,"JMeter","HTTP","issues","RESOLVED","FIXED","Wrong end condition in CookieManager?","2004-11-16 19:05:40"
18853,"JMeter","Main","issues","RESOLVED","FIXED","JDBC loops on connection failure","2004-11-16 19:05:40"
19004,"JMeter","Main","issues","RESOLVED","FIXED","Allow HTTPSampler to delegate redirect handling","2004-11-16 19:05:40"
19021,"JMeter","HTTP","issues","RESOLVED","FIXED","Using multiple threads mismatches Responses to HTTP Requests","2005-03-20 17:06:12"
19065,"JMeter","Main","issues","RESOLVED","FIXED","can not start jmeter and applet error","2005-03-20 17:06:12"
19162,"JMeter","Main","issues","RESOLVED","FIXED","AbstractVisualizer.configure() isn't called when FilePanel's filename field is cleared","2004-11-16 19:05:40"
19163,"JMeter","Main","issues","RESOLVED","FIXED","Write All Data to a File Broken","2004-11-16 19:05:40"
19191,"JMeter","Main","issues","RESOLVED","FIXED","behaviour of add button for ""Patterns to Exclude"" in HTTP Proxy Server is wrong","2005-03-20 17:06:12"
19273,"JMeter","Main","issues","RESOLVED","FIXED","JMeter is not allowing me to log in via forms based authentication","2004-11-16 19:05:40"
19309,"JMeter","HTTP","issues","RESOLVED","INVALID","Maintaining session in HTTPSampler","2004-11-16 19:05:40"
19351,"JMeter","Main","issues","RESOLVED","FIXED","CVS location of images and demos for documentation","2004-11-16 19:05:40"
19378,"JMeter","Main","issues","RESOLVED","FIXED","Remove implementation dependent elements from .jmx to another file","2005-02-17 18:32:40"
19499,"JMeter","Main","issues","RESOLVED","FIXED","Can't save test plan with MailerVisualizer","2005-03-20 17:06:12"
19500,"JMeter","Main","issues","RESOLVED","FIXED","Save on Exit doesn't cancel properly","2005-03-20 17:06:12"
19758,"JMeter","Main","issues","RESOLVED","FIXED","Customisable icons in test tree display","2005-09-06 18:44:59"
19759,"JMeter","Main","issues","RESOLVED","INVALID","GuiTest.jmx needs some workbench entries","2004-11-16 19:05:40"
19761,"JMeter","Main","issues","RESOLVED","FIXED","Workbench items not saved","2004-11-16 19:05:40"
19785,"JMeter","Main","issues","RESOLVED","FIXED","Missing images in component_reference.html","2004-11-16 19:05:40"
19788,"JMeter","Main","issues","RESOLVED","FIXED","Add documentation for _StringFromFile function","2004-11-16 19:05:40"
19805,"JMeter","Main","issues","RESOLVED","FIXED","Build.xml tweak to enable running Anakia under Eclipse","2004-11-16 19:05:40"
20065,"JMeter","HTTP","issues","RESOLVED","FIXED","http redirect does not construct correct redirect url","2004-11-16 19:05:40"
20066,"JMeter","HTTP","issues","RESOLVED","WORKSFORME","Redirect limit to 1 level of recursion","2004-11-16 19:05:40"
20100,"JMeter","HTTP","issues","RESOLVED","FIXED","UserParameterModifier null pointer exception","2004-11-16 19:05:40"
20106,"JMeter","Main","issues","RESOLVED","FIXED","New Sampler for testing the LDAP Server","2004-11-16 19:05:40"
20116,"JMeter","HTTP","issues","RESOLVED","INVALID","Java Date formats are not synchronised i.e. not threadsafe","2004-11-16 19:05:40"
20133,"JMeter","Main","issues","RESOLVED","FIXED","port 80 shouldn't be added to http requests","2004-11-16 19:05:40"
20141,"JMeter","Main","issues","RESOLVED","WORKSFORME","don't use url encoding for multipart/form-data in record mode","2004-11-16 19:05:40"
20142,"JMeter","HTTP","issues","RESOLVED","FIXED","XML assertion","2004-11-16 19:05:40"
20152,"JMeter","Main","issues","RESOLVED","FIXED","Fixes to StringFromFile","2004-11-16 19:05:40"
20181,"JMeter","HTTP","issues","RESOLVED","FIXED","Webservice that require text/xml encoding doesn't work correctly","2004-11-16 19:05:40"
20326,"JMeter","Main","issues","RESOLVED","FIXED","{ENH] Logging: version id, significant events","2004-11-16 19:05:40"
20418,"JMeter","Main","issues","RESOLVED","FIXED","GUI behaviour problems - missing initialisation?","2004-11-16 19:05:40"
20505,"JMeter","Main","issues","RESOLVED","FIXED","Scheduler in JMeter","2004-11-16 19:05:40"
20510,"JMeter","Main","issues","RESOLVED","FIXED","Java Sampler for testing scripts and JMeter functions","2015-03-03 12:52:50"
20532,"JMeter","Main","issues","RESOLVED","FIXED","Utility module to get calling stack (ClassContext)","2004-11-16 19:05:40"
20533,"JMeter","Main","issues","RESOLVED","FIXED","Logging enhancements","2004-11-16 19:05:40"
20553,"JMeter","Main","issues","RESOLVED","FIXED","Build.xml may exclude non-existent files","2004-11-16 19:05:40"
20555,"JMeter","Main","issues","RESOLVED","FIXED","Sample Eclipse classpath file","2004-11-16 19:05:40"
20574,"JMeter","Main","issues","RESOLVED","FIXED","Blank error dialog boxes","2004-11-16 19:05:40"
20575,"JMeter","Main","issues","RESOLVED","FIXED","Command-line and logging enhancements","2004-11-16 19:05:40"
20587,"JMeter","Main","issues","RESOLVED","FIXED","Logging changes to StringFromFile","2004-11-16 19:05:40"
20588,"JMeter","Main","issues","RESOLVED","FIXED","MachineName paramter count correction","2004-11-16 19:05:40"
20589,"JMeter","Main","issues","RESOLVED","FIXED","TableDataModel logging changes","2004-11-16 19:05:40"
20590,"JMeter","Main","issues","RESOLVED","FIXED","CompoundVariable - ignore function call errors","2004-11-16 19:05:40"
20591,"JMeter","Main","issues","RESOLVED","FIXED","Allow links to work in Help window","2004-11-16 19:05:40"
20596,"JMeter","Main","issues","RESOLVED","FIXED","Help no longer scrolls to correct entry if element name changed","2004-11-16 19:05:40"
20669,"JMeter","Main","issues","RESOLVED","FIXED","[PATCH] user documentation updates","2004-11-16 19:05:40"
20697,"JMeter","Main","issues","RESOLVED","FIXED","Patches for documentation","2004-11-16 19:05:40"
20731,"JMeter","Main","issues","RESOLVED","FIXED","Fix up getResString() calls to use proper keys","2004-11-16 19:05:40"
20756,"JMeter","Main","issues","RESOLVED","FIXED","Problems with demo samples","2004-11-16 19:05:40"
20771,"JMeter","Main","issues","RESOLVED","FIXED","[Enh/Patch] New Property function; upated comp ref.","2004-11-16 19:05:40"
20772,"JMeter","Main","issues","RESOLVED","FIXED","Velocity templates generate links to missing  screenshots","2004-11-16 19:05:40"
20776,"JMeter","Main","issues","RESOLVED","FIXED","[Patch] re-enable setResizeWeight to fix LH pane size","2004-11-16 19:05:40"
20780,"JMeter","Main","issues","RESOLVED","FIXED","[patch] Javadoc JMeter API version updated to 1.9","2004-11-16 19:05:40"
20781,"JMeter","Main","issues","RESOLVED","FIXED","[patch] to make JavaTest evaluate parameters each time","2004-11-16 19:05:40"
20905,"JMeter","Main","issues","RESOLVED","FIXED","New version of Logkit for 1.9?","2004-11-16 19:05:40"
20918,"JMeter","Main","issues","RESOLVED","FIXED","Sava Disable Thread Group Flag","2004-11-16 19:05:40"
20925,"JMeter","Main","issues","RESOLVED","FIXED","DB Connection Manager  ConcurrentModificationException","2004-11-16 19:05:40"
20962,"JMeter","Main","issues","RESOLVED","FIXED","[patch] update eclipse.classpath to latest jar versions","2004-11-16 19:05:40"
20978,"JMeter","Main","issues","RESOLVED","FIXED","Jdom.jar omitted from external.jars in build.xml","2004-11-16 19:05:40"
20984,"JMeter","Main","issues","RESOLVED","FIXED","[patch] check/define JMETER_HOME in jmeter-server.bat","2004-11-16 19:05:40"
20988,"JMeter","Main","issues","RESOLVED","FIXED","[patch] eclipse.classpath library updates","2004-11-16 19:05:40"
20997,"JMeter","Main","issues","RESOLVED","WONTFIX","Different behaviour of Response Assertion","2004-11-16 19:05:40"
20998,"JMeter","Main","issues","RESOLVED","FIXED","Assertions and RegexExtractor don't handle null responseData","2004-11-16 19:05:40"
21028,"JMeter","Main","issues","RESOLVED","FIXED","Remote Stop All broken","2005-03-20 17:06:12"
21029,"JMeter","Main","issues","RESOLVED","FIXED","[patch/enh] Allow Ant to run Anakia without external command files","2004-11-16 19:05:40"
21137,"JMeter","Main","issues","RESOLVED","FIXED","build.xml - use printable_project.xml for printable_docs","2004-11-16 19:05:40"
21143,"JMeter","Main","issues","RESOLVED","FIXED","Obsolete doc/images files","2004-11-16 19:05:40"
21155,"JMeter","HTTP","issues","RESOLVED","WONTFIX","Redirect does not preserve port number","2004-11-16 19:05:40"
21156,"JMeter","HTTP","issues","RESOLVED","FIXED","iterations >= 2 of threads do not submit parameters","2004-11-16 19:05:40"
21344,"JMeter","HTTP","issues","RESOLVED","INVALID","Https missing configuration to handle p12 certificates","2005-03-20 17:06:12"
21403,"JMeter","Main","issues","RESOLVED","FIXED","Adding search controls to LDAP Sampler","2004-11-16 19:05:40"
21477,"JMeter","HTTP","issues","RESOLVED","FIXED","On page reached from redirect, images don't load","2004-11-16 19:05:40"
21513,"JMeter","Main","issues","RESOLVED","FIXED","Add ability to set user defined variables from cmd. line","2004-11-16 19:05:40"
21530,"JMeter","Main","issues","RESOLVED","INVALID","Add Clear support to reset listeners","2004-11-16 19:05:40"
21563,"JMeter","Main","issues","RESOLVED","WONTFIX","Memory resource not being cleared","2005-03-20 17:06:12"
21615,"JMeter","Main","issues","RESOLVED","FIXED","HTTP Request protocol field is case sensitive","2004-11-16 19:05:40"
21678,"JMeter","Main","issues","RESOLVED","WORKSFORME","HTTP URL Re-writing Modifier didn't work for the first run of the Test Plan","2005-03-20 17:06:12"
21695,"JMeter","Main","issues","RESOLVED","FIXED","Unix jmeter start script assumes it is on PATH, not a link","2014-01-16 15:34:03"
21728,"JMeter","Main","issues","RESOLVED","FIXED","[patch/enh] remove spurious "">"" chars from Help display","2004-11-16 19:05:40"
21799,"JMeter","HTTP","issues","RESOLVED","FIXED","Putting port as user defined variable stops update of URL on XML-RPC Sampler","2005-03-20 17:06:12"
21839,"JMeter","Main","issues","RESOLVED","FIXED","Thread Groups with same name cause problems","2004-11-16 19:05:40"
21840,"JMeter","Main","issues","RESOLVED","FIXED","If on a redirect, post processors and assertions don't work","2004-11-16 19:05:40"
21886,"JMeter","Main","issues","RESOLVED","FIXED","[extra]  build file for creating local addons","2004-11-16 19:05:40"
21891,"JMeter","Main","issues","RESOLVED","FIXED","Escaping ',' in __javaScript function does not work","2004-11-16 19:05:40"
21938,"JMeter","Main","issues","RESOLVED","FIXED","If test file (.jmx) is not writable, JMeter GUI should popup error/warning dialog on save","2004-11-16 19:05:40"
21940,"JMeter","Main","issues","RESOLVED","FIXED","Pre-Processor Counter doesn't accept user variables for Start, Maximum","2004-11-16 19:05:40"
21960,"JMeter","Main","issues","RESOLVED","FIXED","Update jmeter ant task files","2004-11-16 19:05:40"
21971,"JMeter","Main","issues","RESOLVED","FIXED","HTTP URL Re-writing Modifier doesn't work properly","2005-03-20 17:06:12"
21976,"JMeter","Main","issues","RESOLVED","FIXED","splittings tests in more atomic operations","2004-11-16 19:05:40"
22076,"JMeter","Main","issues","RESOLVED","LATER","global search and replace functionality","2013-02-05 13:35:22"
22171,"JMeter","HTTP","issues","RESOLVED","FIXED","SOAP/XML-RPC sampler doesn't support URL with paramaters","2004-11-16 19:05:40"
22185,"JMeter","Main","issues","RESOLVED","WONTFIX","HTTP User Parameter Modifier using user.xml","2005-03-20 17:06:12"
22225,"JMeter","Main","issues","RESOLVED","WONTFIX","non GUI mode: unable to load a custom property file","2008-04-08 17:43:59"
22275,"JMeter","Main","issues","RESOLVED","FIXED","build.xml: external jars needs to include jdom.jar for XMLAssertion","2004-11-16 19:05:40"
22303,"JMeter","Main","issues","RESOLVED","FIXED","WebServiceSampler requires javax.mail, but should it?","2004-11-16 19:05:40"
22372,"JMeter","HTTP","issues","RESOLVED","INVALID","After Recording with Proxy  get an error because of double hostnames and hosts in the URLs","2005-03-20 17:06:12"
22374,"JMeter","HTTP","issues","RESOLVED","WORKSFORME","Aftre Recording Tescase with Proxy  get errors because of double hostnames and ports","2004-11-16 19:05:40"
22387,"JMeter","HTTP","issues","RESOLVED","WORKSFORME","""HTTP Request Sampler | Parameters | Include Equals"" is broken","2004-11-16 19:05:40"
