"Bug ID","Product","Component","Assignee","Status","Resolution","Summary","Changed"
53418,"JMeter","Main","issues","RESOLVED","FIXED","New Option ""Delay thread creation until needed"" that will create and start threads when needed instead of creating them on Test startup","2012-09-28 14:05:41"
53438,"JMeter","HTTP","issues","RESOLVED","INVALID","Response encoding not showing UTF-8 properly","2012-07-24 20:13:24"
53439,"JMeter","Main","issues","RESOLVED","INVALID","Multiple User Defined Variables with the same variable","2012-06-21 06:22:10"
53440,"JMeter","Main","issues","RESOLVED","FIXED","SSL connection leads to ArrayStoreException on JDK 6 with some KeyManagerFactory SPI","2012-06-27 05:58:44"
53442,"JMeter","Main","issues","RESOLVED","FIXED","Jmeter Not loading WSDL 2.0","2012-06-21 16:06:28"
53477,"JMeter","HTTP","issues","RESOLVED","INVALID","Getting ""Internal Server Error"" while recording in HTTP","2012-06-27 16:49:52"
53487,"JMeter","HTTP","issues","RESOLVED","WONTFIX","Http proxy serer runs OutOfMemory when using GlimmerBlocker if https spoofing not enabled","2012-06-30 06:23:06"
53499,"JMeter","HTTP","issues","RESOLVED","INVALID","Saving the Aggregate Report in command line","2012-07-04 11:25:32"
53501,"JMeter","Main","issues","RESOLVED","DUPLICATE","Synchronization timer blocks test end.","2014-07-06 13:14:03"
53511,"JMeter","HTTP","issues","RESOLVED","FIXED","access log sampler SessionFilter throws NullPointerException - cookie manager not initialized properly","2012-07-18 21:23:24"
53520,"JMeter","Main","issues","RESOLVED","FIXED","JSR223 Elements : Use Compilable interface to improve performances on File scripts","2012-07-08 21:05:06"
53521,"JMeter","HTTP","issues","RESOLVED","FIXED","Cache Manager should cache content with Cache-control=private","2012-07-08 12:50:52"
53522,"JMeter","HTTP","issues","RESOLVED","FIXED","Cache Manager should not store at all response with header ""no-cache"" and store other types of Cache-Control having max-age value","2012-07-14 21:59:02"
53527,"JMeter","Main","issues","RESOLVED","INVALID","Can't seem to import outside jars.","2012-07-09 21:09:45"
53534,"JMeter","Main","issues","RESOLVED","WONTFIX","Wrong escaping in POST requests with parameters","2013-04-12 21:03:24"
53551,"JMeter","HTTP","issues","RESOLVED","INVALID","Getting messsage ""One or more test threads won't exit; see log file.""","2012-07-24 19:56:19"
53559,"JMeter","Main","issues","RESOLVED","WONTFIX","Add JFreeChart Library, Current charting lib JChart lib is outdated and is limited and not under active development","2012-07-17 19:34:58"
53566,"JMeter","Main","issues","RESOLVED","FIXED","Don't log partial responses to the jmeter log","2012-07-20 00:02:28"
53567,"JMeter","Main","issues","RESOLVED","INVALID","Is custom Controller designed to work with TestBean framework?","2012-07-18 23:07:37"
53587,"JMeter","HTTP","issues","RESOLVED","DUPLICATE","""+"" sign not working in ""post body"" of Jmeter 2.6","2012-07-23 11:59:21"
53589,"JMeter","HTTP","issues","RESOLVED","INVALID","Invalid failureproperty received from JMeter ant task","2012-07-24 19:54:53"
53608,"JMeter","Main","issues","RESOLVED","WORKSFORME","Loop count in thread group runs one time less","2012-07-26 21:40:09"
53616,"JMeter","Main","issues","RESOLVED","FIXED","Display 'Apache JMeter' title in app title bar in Gnome 3","2012-07-28 11:33:56"
53671,"JMeter","Main","issues","RESOLVED","FIXED","tearDown thread group to run even if shutdown test happens","2012-08-30 13:35:03"
53673,"JMeter","Main","issues","RESOLVED","FIXED","Add JMeter version in the jmx file","2012-08-30 14:54:41"
53674,"JMeter","Main","issues","RESOLVED","DUPLICATE","Add JMeter version in the jmx file","2012-08-10 13:09:35"
53675,"JMeter","HTTP","issues","RESOLVED","FIXED","Add PATCH verb to HTTP sampler","2012-08-23 02:16:46"
53679,"JMeter","Main","issues","RESOLVED","FIXED","Constant Throughput Timer bug with localization","2013-08-16 14:02:46"
53682,"JMeter","Main","issues","RESOLVED","WORKSFORME","Only the result of last assertion in a tree is taken into account when displaying the results","2012-08-21 23:28:36"
53708,"JMeter","HTTP","issues","RESOLVED","WONTFIX","HTTP Authorization Manager ignores HTTP Request Defaults","2012-08-22 21:08:08"
53709,"JMeter","Main","issues","RESOLVED","INVALID","proxy for ant download-jars","2012-08-13 09:59:57"
53711,"JMeter","Main","issues","RESOLVED","INVALID","Jmeter displays error trying to open testeplan.","2012-08-13 16:51:00"
53715,"JMeter","Main","issues","RESOLVED","FIXED","JMeter does not load WSDL","2012-08-25 19:16:06"
53716,"JMeter","Main","issues","RESOLVED","FIXED","Small improvements in aggregate graph: legend at left or right is now on 1 column (instead of 1 large line), no border to the reference's square color, reduce width on some fields","2012-08-14 13:49:58"
53718,"JMeter","Main","issues","RESOLVED","FIXED","Add a new visualizer 'Response Time Graph' to draw a line graph showing the evolution of response time for a test","2012-09-14 07:06:38"
53726,"JMeter","HTTP","issues","RESOLVED","WORKSFORME","httpclient.localaddress property has no effect","2012-08-15 21:33:36"
53738,"JMeter","Main","issues","RESOLVED","FIXED","Keep track of number of threads started and finished","2012-08-22 21:57:03"
53742,"JMeter","Main","issues","RESOLVED","FIXED","When jmeter.save.saveservice.sample_count is set to true, elapsed time read by listener is always equal to 0","2012-08-19 23:43:41"
53743,"JMeter","Main","issues","RESOLVED","DUPLICATE","JavaSamplers.allSamplers static Set keeps references even after thread has ended","2012-08-29 11:14:53"
53744,"JMeter","Main","issues","RESOLVED","INVALID","Provide a way to preload specified JMeter properties as JMeter Variables.","2012-08-20 07:14:34"
53746,"JMeter","Main","issues","RESOLVED","INVALID","The regular expression extractor interprets + as %2B, / as %2F and = as %3D","2012-08-20 18:37:22"
53749,"JMeter","Main","issues","RESOLVED","FIXED","TestListener interface could perhaps be split up","2012-08-22 22:58:57"
53750,"JMeter","Main","issues","RESOLVED","FIXED","TestCompiler saves unnecessary entries in pairing collection","2012-08-21 01:17:30"
53753,"JMeter","Main","issues","RESOLVED","FIXED","Summariser: no point displaying fractional time in most cases","2012-08-21 14:24:42"
53755,"JMeter","HTTP","issues","RESOLVED","FIXED","Adding a HttpClient 4 cookie implementation in JMeter. Cookie Manager has now the default HC3.1 implementation and a new choice HC4 implementation (compliant with IPv6 address)","2012-09-28 18:38:17"
53759,"JMeter","Main","issues","RESOLVED","FIXED","ClientJMeterEngine perfoms unnecessary traverse using SearchByClass(TestListener)","2012-08-21 22:56:53"
53765,"JMeter","Main","issues","RESOLVED","FIXED","Switch to commons-lang3-3.1","2012-08-23 00:58:44"
53774,"JMeter","Main","issues","RESOLVED","FIXED","RequestViewRaw does not show headers unless samplerData is non-null","2012-08-24 12:03:56"
53782,"JMeter","Main","issues","RESOLVED","FIXED","Enhance JavaSampler handling of JavaSamplerClient cleanup to use less memory","2012-08-29 11:14:53"
53796,"JMeter","Main","issues","RESOLVED","FIXED","TestCompiler uses static Set which can grow huge","2012-08-30 00:31:16"
53802,"JMeter","Main","issues","RESOLVED","FIXED","IdleTime values are not saved  to CSV log","2012-08-30 16:33:33"
53806,"JMeter","Main","issues","RESOLVED","FIXED","FileServer should provide thread-safe parsing","2012-09-17 19:52:47"
53807,"JMeter","Main","issues","RESOLVED","FIXED","CSV Dataset does not handle embedded new lines in quoted data","2012-09-13 23:02:21"
53826,"JMeter","Main","issues","RESOLVED","INVALID","NOT able to connect .csv file to JDBC Request","2012-09-04 10:03:19"
53834,"JMeter","Main","issues","RESOLVED","INVALID","[WARN ] Thread table can't grow past 16383 threads.","2012-09-10 19:01:59"
53838,"JMeter","Main","issues","RESOLVED","FIXED","Pressing ""Stop"" does not interrupt the TCP sampler","2012-09-09 14:51:20"
53840,"JMeter","HTTP","issues","RESOLVED","FIXED","Proxy Recording : Response message: URLDecoder: Illegal hex characters in escape (%) pattern - For input string: """" ""","2012-12-01 23:35:09"
53841,"JMeter","Main","issues","RESOLVED","FIXED","CSVSaveService reads file using JVM default file encoding instead of using the one configured in saveservice.properties","2012-09-08 08:32:47"
53844,"JMeter","Main","issues","RESOLVED","FIXED","JDBC related elements should check class of Variable Name supposed to contain JDBC Connection Configuration to avoid ClassCastException","2012-09-08 13:47:12"
53851,"JMeter","Main","issues","RESOLVED","INVALID","Oracle CURSOR still returns : ORA-06553: PLS-306: wrong number or types of arguments in call to 'WTRK11GET_1'ORA-06553: PLS-306: wrong number or types of arguments in call to 'WTRK11GET_1'","2012-09-11 16:15:45"
53855,"JMeter","Main","issues","RESOLVED","INVALID","A CSV <EOF> condition is not interpreted as Boolean False by the While-controller","2012-09-12 00:19:23"
53856,"JMeter","Main","issues","RESOLVED","INVALID","While-contoller's seems to check the condition at the end, rather than beginning of the loop","2012-09-12 03:48:25"
53862,"JMeter","Main","issues","RESOLVED","FIXED","Would be nice to have the JMeter Version available as a property","2012-09-12 22:23:11"
53874,"JMeter","HTTP","issues","RESOLVED","FIXED","View Results Tree : If some parameter containing special characters like % is not encoded, RequestViewHTTP fails with  java.lang.IllegalArgumentException: URLDecoder: Illegal hex characters in escape (%) pattern and Response is not displayed","2012-09-15 09:45:38"
53875,"JMeter","HTTP","issues","RESOLVED","FIXED","Include suggested defaults for URL filters on HTTP Proxy","2012-10-14 18:50:44"
53876,"JMeter","HTTP","issues","RESOLVED","FIXED","Allow URL Filters (HTTP Proxy) to be pasted from clipboard","2012-09-16 21:29:30"
53879,"JMeter","Main","issues","RESOLVED","FIXED","GUI : Allow Popups to be closed with ESC key","2012-09-17 20:13:19"
53884,"JMeter","Main","issues","RESOLVED","FIXED","wrong Maven groupId for commons-lang","2012-09-17 16:42:00"
53890,"JMeter","Main","issues","RESOLVED","INVALID","Jmeter JMS ponit to point request response","2012-09-18 19:01:53"
53911,"JMeter","Main","issues","RESOLVED","FIXED","JmeterKeystore does not allow for key down the list of certificate","2012-09-27 21:01:35"
53922,"JMeter","HTTP","issues","RESOLVED","WONTFIX","Using HTTPS with a Certificate not matching Host leads to javax.net.ssl.SSLPeerUnverifiedException: peer not authenticated","2012-09-23 18:32:37"
53928,"JMeter","HTTP","issues","RESOLVED","INVALID","this error is shown in jmeter.log file.","2012-09-24 10:54:29"
53931,"JMeter","HTTP","issues","RESOLVED","FIXED","Define HTTPClient 4 for the default HTTP Request (and Proxy element to generate the HTTP requests)","2012-09-25 21:03:15"
53934,"JMeter","HTTP","issues","RESOLVED","FIXED","Removes HTTPS spoofing options in JMeter HTTP Proxy Server. Since JMeter 2.4, the HTTPS protocol is directly supported by the proxy.","2012-09-25 22:16:39"
53941,"JMeter","HTTP","issues","RESOLVED","FIXED","Add latency to View Result table listener","2012-09-27 20:30:43"
53944,"JMeter","Main","issues","RESOLVED","WONTFIX","Enhancement Request - Function needed for ON_SAMPLE_ERROR_START_NEXT_LOOP","2012-12-23 13:53:13"
53953,"JMeter","Main","issues","RESOLVED","FIXED","Typo in monitor test plan documentation","2012-10-02 20:50:52"
53956,"JMeter","Main","issues","RESOLVED","FIXED","Add ability to paste (a list of values) from clipboard for Header Manager","2012-10-13 19:39:06"
53975,"JMeter","Main","issues","RESOLVED","FIXED","Variables replacement doesn't work with option ""Delay thread creation until needed""","2013-01-24 20:30:26"
53978,"JMeter","HTTP","issues","RESOLVED","WONTFIX","SoapSampler : Add an option to allow empty response as successful result","2012-11-12 20:46:43"
53989,"JMeter","Main","issues","RESOLVED","WORKSFORME","${variable_name} replaces variable value in 1% of runs","2012-11-06 22:00:56"
53995,"JMeter","Main","issues","RESOLVED","FIXED","AbstractJDBCTestElement shares PreparedStatement between multi-threads","2012-10-27 14:53:45"
53997,"JMeter","Main","issues","RESOLVED","FIXED","LDAP Extended Request: Escape ampersand (&), left angle bracket (<) and right angle bracket (>) in search filter tag in XML response data","2012-10-13 17:23:34"
54004,"JMeter","HTTP","issues","RESOLVED","FIXED","Webservice Sampler : Allow adding headers to request with Header Manager","2012-10-14 13:41:16"
54006,"JMeter","HTTP","issues","RESOLVED","WONTFIX","Webservice Sampler : Response status 500 is not considered as an error due to soap-2.3.1 limitation","2012-11-12 20:45:59"
54014,"JMeter","Main","issues","RESOLVED","WONTFIX","Child nodes within an IF Controller not being executed unless there's a Sampler among them","2012-10-16 15:32:03"
54020,"JMeter","Main","issues","RESOLVED","INVALID","GUI doesn't remember preferred language","2014-09-09 11:36:25"
54031,"JMeter","Main","issues","RESOLVED","FIXED","Add tooltip to running/total threads indicator","2012-10-20 14:35:50"
54048,"JMeter","Main","issues","RESOLVED","WORKSFORME","less type choices in JDBC request output(callablestatement)","2012-10-27 18:36:55"
54055,"JMeter","Main","issues","RESOLVED","FIXED","View Results tree: = signs are stripped from parameter values at HTTP tab","2012-10-26 21:24:55"
54057,"JMeter","HTTP","issues","RESOLVED","FIXED","Proxy option to set user and password at startup (-u and -a) not working with HTTPClient 4","2012-11-30 11:20:05"
54058,"JMeter","HTTP","issues","RESOLVED","FIXED","In HTTP Request Defaults, the value of field ""Embedded URLs must match: is not saved if the check box ""Retrieve All  Embedded Resources"" is not checked.","2012-10-26 17:12:19"
54073,"JMeter","Main","issues","RESOLVED","WORKSFORME","Remote execution non-gui mode -G doesn't parse parameters properly to the slave load generators","2013-06-17 07:03:23"
54088,"JMeter","Main","issues","RESOLVED","FIXED","The type video/f4m is text, not binary","2012-11-01 17:20:17"
54097,"JMeter","Main","issues","RESOLVED","WORKSFORME","CSV Data Set Config not working in distributed mode","2013-01-17 22:45:29"
54106,"JMeter","Main","issues","RESOLVED","FIXED","JSR223TestElement should check for file existence when a filename is set instead of using Text Area content","2012-11-06 18:59:55"
54107,"JMeter","Main","issues","RESOLVED","FIXED","JSR223TestElement : Enable compilation and caching of Script Text","2012-11-06 21:26:12"
54109,"JMeter","Main","issues","RESOLVED","FIXED","JSR223TestElement : SampleResult properties should be set before entering script to allow user setting different code","2012-11-18 22:37:24"
54110,"JMeter","Main","issues","RESOLVED","FIXED","BSFTestElement and JSR223TestElement should use shared super-class for common fields","2012-11-08 00:36:09"
54119,"JMeter","HTTP","issues","RESOLVED","FIXED","HTTP 307 response is not redirected","2012-11-08 12:04:14"
54129,"JMeter","Main","issues","RESOLVED","FIXED","Search Feature does not find text although existing in elements","2012-11-09 23:45:07"
54131,"JMeter","Main","issues","RESOLVED","FIXED","ForEach Controller : Add start and end index for looping over variables","2012-11-10 16:13:06"
54132,"JMeter","Main","issues","RESOLVED","FIXED","Module Controller GUI : Improve rendering of referenced controller","2012-11-15 22:17:29"
54142,"JMeter","HTTP","issues","RESOLVED","FIXED","HTTP Proxy Server throws an exception when path contains ""|"" character","2013-08-07 21:27:19"
54154,"JMeter","Main","issues","RESOLVED","FIXED","HTTP Proxy Server should not force user to select the type of Sampler in HTTP Sampler Settings","2013-01-23 20:07:46"
54155,"JMeter","Main","issues","RESOLVED","FIXED","ModuleController : Add a shortcut button to unfold the tree up to referenced controller and highlight it","2013-08-25 13:18:32"
54160,"JMeter","Main","issues","RESOLVED","FIXED","Add support for xpath assertion to apply to a JMeter variable.","2013-01-05 21:20:23"
54161,"JMeter","HTTP","issues","RESOLVED","FIXED","Proxy : be able to create binary sampler for x-www-form-urlencoded POST request","2012-11-18 10:08:43"
54165,"JMeter","HTTP","issues","RESOLVED","FIXED","Proxy Server: Improve rendering of target controller","2012-11-18 22:53:33"
54166,"JMeter","HTTP","issues","RESOLVED","FIXED","ViewResultsTree could not render the HTML response","2012-11-20 01:26:08"
54172,"JMeter","Main","issues","RESOLVED","FIXED","Duplicate shortcut key not working and CTRL+C / CTRL+V / CTRL+V do not cancel default event","2012-11-19 22:33:29"
54175,"JMeter","Main","issues","RESOLVED","INVALID","""java.net.UnknownHostException: <Site URL>"" error is coming on recording the test cases.","2012-11-20 08:01:33"
54182,"JMeter","Main","issues","RESOLVED","FIXED","Support sending of ByteMessage for JMS Publisher.","2013-01-08 07:54:44"
54185,"JMeter","HTTP","issues","RESOLVED","FIXED","Allow query strings in paths that start with HTTP or HTTPS","2012-11-22 13:37:25"
54187,"JMeter","HTTP","issues","RESOLVED","FIXED","Request tab does not show headers if request fails","2012-12-20 20:38:08"
54189,"JMeter","Main","issues","RESOLVED","FIXED","Add a function to quote ORO regexp meta characters","2012-11-22 12:35:47"
54193,"JMeter","Main","issues","RESOLVED","WONTFIX","Add checkbox to Visualizer","2012-11-23 17:19:18"
54199,"JMeter","Main","issues","RESOLVED","FIXED","Move to Java 6","2012-12-02 19:53:42"
54200,"JMeter","Main","issues","RESOLVED","FIXED","Add support of several document types (like Apache OpenOffice's files, MS Office's files, PDF's files, etc.) to the elements View Results Tree, Assertion Response and Regular Expression Extractor (in using Apache Tika)","2012-11-29 09:18:56"
54204,"JMeter","Main","issues","RESOLVED","FIXED","Result Status Action Handler : Add start next thread loop option","2012-11-25 15:06:24"
54226,"JMeter","HTTP","issues","RESOLVED","FIXED","View Results Tree : Show response even when server does not return ContentType header","2012-12-01 22:05:31"
54230,"JMeter","Main","issues","RESOLVED","FIXED","TCP Sampler, additions of ""Close Connection"", ""SO_LINGER"" and ""End of line(EOL) byte value"" options","2012-12-20 22:33:35"
54232,"JMeter","Main","issues","RESOLVED","FIXED","Search Feature : Add a button to search and expand results","2012-12-02 13:45:03"
54237,"JMeter","Main","issues","RESOLVED","INVALID","return ""connection reset"" if ssl certification expired","2013-01-01 20:32:44"
54238,"JMeter","Main","issues","RESOLVED","LATER","TCP Sampler - an addition of ""Waiting for response"" option?","2012-12-04 10:24:46"
54251,"JMeter","Main","issues","RESOLVED","FIXED","Add tristate checkbox implementation","2013-08-15 21:33:30"
54257,"JMeter","HTTP","issues","RESOLVED","FIXED","Enhance SamplerCreator interface to meet new requirements","2012-12-07 14:52:35"
54258,"JMeter","HTTP","issues","RESOLVED","FIXED","Proxy : Use Raw Post Body when Sampler has one unnamed argument, useful for Samplers using POST method by of type JSON, XML, GWT body","2012-12-07 15:10:25"
54259,"JMeter","HTTP","issues","RESOLVED","FIXED","Introduce a new Extractor that uses CSS or jquery-like selector syntax","2012-12-20 20:56:32"
54264,"JMeter","Main","issues","RESOLVED","INVALID","random variable problem when you set a seed","2012-12-16 22:00:49"
54267,"JMeter","Main","issues","RESOLVED","FIXED","Start Next Thread Loop setting doesn't work in custom thread groups","2012-12-08 12:42:42"
54268,"JMeter","Main","issues","RESOLVED","FIXED","Improve CPU and memory usage","2014-02-17 13:50:01"
54271,"JMeter","Main","issues","RESOLVED","DUPLICATE","Module Controller breaks if test plan is renamed","2013-08-03 20:58:55"
54274,"JMeter","Main","issues","RESOLVED","INVALID","Property Jincludecontroller.prefix is Missing in Jmeter 2.8","2012-12-17 06:40:33"
54286,"JMeter","Main","issues","RESOLVED","INVALID","""Average"" keeps increasing while testing load with DB2","2012-12-12 22:46:30"
54287,"JMeter","Main","issues","RESOLVED","FIXED","Incorrect Timestamp in Response Time Graph when using a date with time in Date format field","2012-12-13 13:14:36"
54317,"JMeter","Main","issues","RESOLVED","DUPLICATE","__Random in a Loop Condition sometimes makes the thread skip the loop.","2013-01-22 21:21:51"
54321,"JMeter","Main","issues","RESOLVED","DUPLICATE","View Results Tree does not show headers from failed requests","2012-12-20 20:38:08"
54326,"JMeter","Main","issues","RESOLVED","FIXED","AjpSampler send file in post throws FileNotFoundException","2012-12-20 12:55:51"
54331,"JMeter","HTTP","issues","RESOLVED","FIXED","AjpSampler throws null pointer on GET request that are protected","2012-12-20 13:17:50"
54351,"JMeter","HTTP","issues","RESOLVED","FIXED","HC4 and URI fragments is failing","2013-08-08 09:37:57"
54362,"JMeter","HTTP","issues","RESOLVED","INVALID","Error in using Javascript in While Controller.","2012-12-31 13:01:01"
54375,"JMeter","HTTP","issues","RESOLVED","FIXED","Regular Expression Extractor : When regex syntax is wrong, post processing is stopped","2013-01-04 22:07:12"
54376,"JMeter","Main","issues","RESOLVED","FIXED","ScopePanel : Allow configuring more precisely scopes","2013-01-05 20:38:17"
54389,"JMeter","Main","issues","RESOLVED","INVALID","Improvement CSV Data Set Config skip first row containing headers","2013-01-08 19:40:18"
54404,"JMeter","Main","issues","RESOLVED","WONTFIX","line separator in JMX files is not \r\n as specified in VisualVm but \n","2013-01-11 15:24:12"
54409,"JMeter","HTTP","issues","RESOLVED","WONTFIX","Request Header Authorization is not shown in Request Tab of View Results Tree","2013-01-11 22:48:05"
54410,"JMeter","HTTP","issues","RESOLVED","INVALID","Request timeout","2013-01-12 20:31:46"
54412,"JMeter","Main","issues","RESOLVED","FIXED","Changing JMeter defaults to ensure better performances by default","2013-01-13 15:26:34"
54413,"JMeter","HTTP","issues","RESOLVED","FIXED","DataStrippingSampleSender returns 0 for number of bytes of any response","2013-01-12 21:59:42"
54414,"JMeter","Main","issues","RESOLVED","FIXED","Remote Test should not start if one of the engines fails to start correctly","2013-01-14 20:16:36"
54418,"JMeter","Main","issues","RESOLVED","FIXED","UUID Function","2013-01-14 22:11:26"
54441,"JMeter","Main","issues","RESOLVED","WONTFIX","File name is not resolving in csv dataset file name field","2013-01-22 20:50:43"
54447,"JMeter","Main","issues","RESOLVED","INVALID","It should be possible to use variable replacement in XPathExtractor XPath definition","2013-01-18 09:12:39"
54453,"JMeter","Main","issues","RESOLVED","FIXED","Performance enhancements : Replace Random by ThreadLocalRandom in __Random function","2014-11-10 14:40:33"
54459,"JMeter","Main","issues","RESOLVED","FIXED","CSVSaveService does not handle date parsing very well","2013-01-22 02:00:28"
54465,"JMeter","HTTP","issues","RESOLVED","INVALID","Issues with Proxy Server Recording","2013-01-22 09:08:37"
54477,"JMeter","Main","issues","RESOLVED","WONTFIX","Incorrect menu position in GNOME 3 when JMeter windows is maximized and run with Java 6","2014-01-16 07:49:52"
54480,"JMeter","HTTP","issues","RESOLVED","DUPLICATE","Specifying a variable for duration and delaying thread startup causes the test to not run","2013-01-24 20:30:26"
54482,"JMeter","HTTP","issues","RESOLVED","FIXED","HC fails to follow redirects with non-encoded chars","2013-08-08 11:59:08"
54501,"JMeter","Main","issues","RESOLVED","INVALID","After adding plugin menu display is not complete","2013-01-29 11:53:33"
54504,"JMeter","Main","issues","RESOLVED","FIXED","Resource string not found: [clipboard_node_read_error]","2013-05-17 12:09:32"
54516,"JMeter","Main","issues","RESOLVED","DUPLICATE","Attempting to Copy an element results in error message","2013-02-01 14:13:36"
54529,"JMeter","Main","issues","RESOLVED","INVALID","Unable to parameterize GWT RPC payload structure through jmeter Directly","2013-02-05 16:29:06"
54530,"JMeter","Main","issues","RESOLVED","WORKSFORME","errors in summariser logs (time gets out of sync)","2013-02-11 21:24:34"
54532,"JMeter","Main","issues","RESOLVED","FIXED","Improve Response Time Graph Y axis scale with huge values or small values (< 1000ms). Add a new field to define increment scale.","2013-02-09 17:37:00"
54538,"JMeter","Main","issues","RESOLVED","FIXED","GUI: context menu is too big","2014-04-04 21:26:41"
54540,"JMeter","Main","issues","RESOLVED","FIXED","""HTML Parameter Mask"" are not marked deprecated in the IHM","2013-02-10 15:30:40"
54553,"JMeter","HTTP","issues","RESOLVED","FIXED","Mispelling Word on remote test usermanual","2013-02-17 13:54:06"
54562,"JMeter","Main","issues","RESOLVED","WORKSFORME","Web methods for SOAP request does not retain the selection","2013-02-17 13:50:53"
54575,"JMeter","HTTP","issues","RESOLVED","FIXED","CSS/JQuery Extractor : Choosing JODD Implementation always uses JSOUP","2013-02-18 19:31:49"
54576,"JMeter","Main","issues","RESOLVED","FIXED","View Results Tree : Add a CSS/JQuery Tester","2013-07-24 08:05:47"
54581,"JMeter","Main","issues","RESOLVED","FIXED","CTRL+F1 for function dialog open does not work for JMeter 2.9","2013-04-13 16:41:32"
54582,"JMeter","Main","issues","RESOLVED","WORKSFORME","Exception in thread ""Thread-85816"" java.lang.NullPointerException.","2013-02-25 20:31:50"
54584,"JMeter","Main","issues","RESOLVED","FIXED","MongoDB plugin","2013-09-09 20:07:46"
54589,"JMeter","Main","issues","RESOLVED","FIXED","View Results Tree have a lot of Garbage characters if html page uses double-byte charset","2013-02-26 16:34:23"
54598,"JMeter","HTTP","issues","RESOLVED","INVALID","Exceeding httpsampler.max_redirects rise an exception","2013-02-27 12:49:19"
54600,"JMeter","HTTP","issues","RESOLVED","INVALID","JMeter should not kill Remote Servers via client ""Remote Exit"" commands","2013-02-22 17:58:04"
