"Bug ID","Product","Component","Assignee","Status","Resolution","Summary","Changed"
49007,"Log4j","Layout","log4j-dev","RESOLVED","FIXED","CachedDateFormatTest fails on Apache Harmony","2010-03-27 06:11:05"
49010,"Log4j","Layout","log4j-dev","RESOLVED","FIXED","Add name abbreviator to drop n leading elements from names.","2010-03-28 01:59:47"
49071,"Log4j","Other","log4j-dev","RESOLVED","FIXED","1.2.16 isn't available for download","2011-08-15 21:15:44"
49077,"Log4j","Other","log4j-dev","RESOLVED","FIXED","Prepare smaller jar omitting LF5 and Chainsaw 1","2012-05-30 05:19:36"
49078,"Log4j","Other","log4j-dev","RESOLVED","FIXED","log4j-1.2.16-javadoc.jar was missing NOTICE and LICENSE and contained .svn entries","2010-06-20 00:08:15"
49229,"Log4j","Other","log4j-dev","RESOLVED","FIXED","build.xml reference wrong javax mail version, should be 1.4.1","2010-10-07 00:28:58"
49243,"Log4j","Site & Docs","log4j-dev","RESOLVED","FIXED","Fix one BZ number in Changelog of 1.2.16","2012-05-26 15:20:23"
49329,"Log4j","Layout","log4j-dev","RESOLVED","WORKSFORME","Smart and compact formatting of package/class names.","2010-11-13 00:46:23"
49359,"Log4j","Site & Docs","log4j-dev","RESOLVED","FIXED","Log4j site should have some mention of git mirroring","2012-05-30 05:36:00"
49361,"Log4j","Other","log4j-dev","RESOLVED","FIXED","Remove log4j 1.3 and log4j 2.0 from main log4j bar on the left","2010-06-07 01:05:08"
49362,"Log4j","Other","log4j-dev","RESOLVED","FIXED","Log4j link from main bar on left is incorrect","2010-06-07 01:02:37"
49390,"Log4j","Companions","log4j-dev","RESOLVED","FIXED","1.0 releases of log4j companions component and receivers","2013-05-16 09:14:00"
49470,"Log4j","Other","log4j-dev","RESOLVED","FIXED","log4j 1.2.17 release","2012-05-04 04:56:28"
49471,"Log4j","Layout","log4j-dev","RESOLVED","WONTFIX","Add CDATA parameter to XmlLayout","2010-11-17 19:37:40"
49628,"Log4j","Configurator","log4j-dev","RESOLVED","INVALID","log4j fails to work in an applet environment","2010-07-21 09:23:08"
49932,"Log4j","Other","log4j-dev","RESOLVED","FIXED","Additional OSGI/BND configuration elements","2012-05-31 13:04:38"
50039,"Log4j","Layout","log4j-dev","RESOLVED","FIXED","Request: single character form of priority in PatternLayout","2010-10-28 23:39:03"
50287,"Log4j","Other","log4j-dev","RESOLVED","FIXED","Broken links in the log4j introduction manual","2010-11-19 08:10:30"
50369,"Log4j","Site & Docs","log4j-dev","RESOLVED","FIXED","Missing comma in class header Javadoc for Level","2013-04-14 02:16:45"
50486,"Log4j","Other","log4j-dev","RESOLVED","FIXED","Memoryleak - org.apache.log4j.helpers.ThreadLocalMap","2014-02-17 13:48:50"
50548,"Log4j","Other","log4j-dev","RESOLVED","WONTFIX","Log4j v1.2 download page serving HTML files rather than archives","2011-01-09 01:16:28"
51027,"Log4j","Appender","log4j-dev","RESOLVED","INVALID","Stuck Thread due to lock contention with RollingFileAppender","2011-04-07 01:02:47"
51114,"Log4j","chainsaw","log4j-dev","RESOLVED","FIXED","Chainsaw Logger  is hanged After click on Release Note's Yes/No button.","2011-04-25 11:36:06"
51192,"Log4j","Other","log4j-dev","RESOLVED","FIXED","Appender dynamic MBean Threshold not accessible through jconsole","2011-05-13 18:21:04"
51361,"Log4j","Site & Docs","log4j-dev","RESOLVED","FIXED","Inheritance spelled ""inheritence"" in documentation","2012-05-26 15:50:31"
51597,"Log4j","Appender","log4j-dev","RESOLVED","FIXED","JDBCAppender not closed due to SQL Exception while executing an SQL","2012-01-13 23:17:15"
51612,"Log4j","Other","log4j-dev","RESOLVED","WONTFIX","LoggingEvent can contain wrong thread name in multithreaded environment","2011-08-11 14:48:21"
52018,"Log4j","Other","log4j-dev","RESOLVED","DUPLICATE","log4j 1.2.16 has wrong import-package entries in manifiest.mf","2011-10-14 05:46:38"
52155,"Log4j","Appender","log4j-dev","RESOLVED","INVALID","Application getting stuck at  java.io.FileOutputStream.writeBytes","2011-11-10 05:22:37"
52424,"Log4j","Site & Docs","log4j-dev","RESOLVED","FIXED","Misspelled words in FAQ","2012-05-26 15:39:00"
52913,"Log4j","Configurator","log4j-dev","RESOLVED","FIXED","Configure from an InputStream","2012-04-11 02:26:29"
53315,"Log4j","Site & Docs","log4j-dev","RESOLVED","FIXED","[PATCH] PropertyConfigurator javadoc fixes","2012-05-29 18:05:23"
53417,"Log4j","Companions","log4j-dev","RESOLVED","DUPLICATE","Extras TimeBasedRollingPolicy does not compress log files","2013-05-16 09:23:17"
53519,"Log4j","Companions","log4j-dev","RESOLVED","FIXED","Fix FullCycleDBTest","2012-07-07 17:28:20"
53536,"Log4j","Companions","log4j-dev","RESOLVED","FIXED","RollingFileAppender with TimeBasedRolling policy doesn't create parent-path if FileNamePattern contains date pattern as directory","2013-05-16 09:41:46"
53537,"Log4j","Site & Docs","log4j-dev","RESOLVED","FIXED","1.2.17 download links broken","2012-07-12 09:52:21"
53548,"Log4j","Companions","log4j-dev","RESOLVED","FIXED","Log4j extras FormattingInfoTest failing","2012-07-19 16:25:03"
53645,"Log4j","Companions","log4j-dev","RESOLVED","FIXED","DBAppender has a compile error","2013-05-16 09:09:04"
53771,"Log4j","chainsaw","log4j-dev","RESOLVED","FIXED","Fix Java 7 Gump-reported compilation failure","2012-08-24 05:39:44"
53781,"Log4j","Other","log4j-dev","RESOLVED","INVALID","Need multiple logger instances in multithreaded environment","2012-08-29 00:27:21"
54053,"Log4j","Configurator","log4j-dev","RESOLVED","INVALID","LogManager initialization failed when running from Jdeveloper.","2012-10-26 03:55:42"
54815,"Log4j","Appender","log4j-dev","RESOLVED","INVALID","SyslogAppender and remote rsyslog server","2013-04-10 04:39:56"
54845,"Log4j","Site & Docs","log4j-dev","RESOLVED","FIXED","Typo in log4j 1.2 manual","2013-04-16 02:57:42"
55188,"Log4j","chainsaw","log4j-dev","RESOLVED","INVALID","how to connect to remote jboss server","2013-07-03 19:37:41"
55213,"Log4j","chainsaw","log4j-dev","RESOLVED","INVALID","Reg: Chainsaw","2013-07-12 17:58:05"
56505,"Log4j","Appender","log4j-dev","RESOLVED","INVALID","Trace level logging broken when code is built with Java 6 Update 45 JDK","2014-05-08 18:24:42"
56912,"Log4j","Configurator","log4j-dev","RESOLVED","INVALID","<Configuration monitorInterval=""30""> not working","2014-09-04 14:54:02"
3,"Log4j","Appender","log4j-dev","RESOLVED","FIXED","file sharing","2005-03-20 17:06:12"
29,"Log4j","Other","log4j-dev","RESOLVED","FIXED","Calling Category.error(Object, Throwable) throws NullPointerException in Version 1.0.2","2004-11-16 19:05:37"
43,"Log4j","Other","log4j-dev","RESOLVED","FIXED","appletviewer/Category bug","2005-03-20 17:06:12"
77,"Log4j","Appender","log4j-dev","RESOLVED","FIXED","Endless loop if the port is in use.","2005-05-11 14:02:57"
657,"Log4j","Appender","log4j-dev","RESOLVED","FIXED","NTEventLogAppender has problem with Event Categories","2004-11-16 19:05:38"
659,"Log4j","Appender","log4j-dev","RESOLVED","FIXED","NTEventLogAppender cannot be configured using Property File","2004-11-16 19:05:38"
851,"Log4j","Configurator","log4j-dev","RESOLVED","FIXED","DOM Configurator not throwing exception when target logfile location points to a read-only file","2004-12-13 09:01:49"
1307,"Log4j","Other","log4j-dev","RESOLVED","FIXED","Wrong Output of LocationInfo.getClassName() in VisualAge","2004-11-16 19:05:38"
1389,"Log4j","Other","log4j-dev","RESOLVED","FIXED","build.sh script shouldn't be in DOS format","2004-11-16 19:05:38"
1491,"Log4j","Other","log4j-dev","RESOLVED","FIXED","Doesn't work on IBM jre which doesn't have sun.misc.InvalidJarIndexException","2004-11-16 19:05:38"
1658,"Log4j","Configurator","log4j-dev","RESOLVED","INVALID","DOMConfigurator problem when used within a JUnit TestCase","2004-11-16 19:05:38"
1703,"Log4j","Other","log4j-dev","RESOLVED","FIXED","javadoc is badly wrong for Category.getAllAppenders()","2005-03-20 17:06:12"
1876,"Log4j","Other","log4j-dev","RESOLVED","FIXED","Namespaces omitted in examples","2004-11-16 19:05:38"
1934,"Log4j","Appender","log4j-dev","RESOLVED","REMIND","RollingFileAppender fails using Microsoft JVM","2005-03-20 17:06:12"
1987,"Log4j","Other","log4j-dev","RESOLVED","INVALID","Location info incorrect because FQCN can not be overriden","2004-11-16 19:05:38"
2060,"Log4j","Layout","log4j-dev","RESOLVED","FIXED","DateLayout.setDateFormat fails for a SimpleDateFormat string parameter","2005-03-20 17:06:12"
2076,"Log4j","Other","log4j-dev","RESOLVED","FIXED","Category and OptionConverter no longer use ClassLoader for Properties","2004-11-16 19:05:38"
2167,"Log4j","Configurator","log4j-dev","RESOLVED","WORKSFORME","Conflict with Xalan","2004-11-16 19:05:38"
2180,"Log4j","Appender","log4j-dev","RESOLVED","INVALID","Console Appender and JBoss","2005-03-20 17:06:12"
2181,"Log4j","Appender","log4j-dev","RESOLVED","INVALID","socket appender fails to transmit serializable throwable in logging event","2005-03-20 17:06:12"
2224,"Log4j","Appender","log4j-dev","RESOLVED","INVALID","Feature request: defered logging","2004-11-16 19:05:38"
2242,"Log4j","Appender","log4j-dev","RESOLVED","WORKSFORME","org.apache.log4j.RollingFileAppender class missing from log4j 1.1.3","2005-03-20 17:06:12"
2246,"Log4j","Layout","log4j-dev","RESOLVED","FIXED","Throwable indentation & improving String escapeHTMLTags(String input)","2005-03-20 17:06:12"
2251,"Log4j","Configurator","log4j-dev","RESOLVED","FIXED","org.apache.log4j.helpers.OptionConverter's reference to DOMConfigurator","2004-11-16 19:05:38"
2276,"Log4j","Other","log4j-dev","RESOLVED","WORKSFORME","stack trace of the exception is not getting logged","2004-11-16 19:05:38"
2287,"Log4j","Other","log4j-dev","RESOLVED","FIXED","Hierarchy.disable package scoped","2004-11-16 19:05:38"
2316,"Log4j","Other","log4j-dev","RESOLVED","FIXED","Category implementation 'enhancement'","2004-11-16 19:05:38"
2341,"Log4j","Appender","log4j-dev","RESOLVED","FIXED","FileAppender should explicitly buffer output?","2004-11-16 19:05:38"
2370,"Log4j","Other","log4j-dev","RESOLVED","LATER","Rewrite PatternTest to use JUnit","2004-11-16 19:05:38"
2377,"Log4j","Other","log4j-dev","RESOLVED","FIXED","A java.lang.ExceptionInInitializerError is thrown when creating Category","2005-03-20 17:06:12"
2381,"Log4j","Other","log4j-dev","RESOLVED","INVALID","Priority could be made ""serializable friendly""","2004-11-16 19:05:38"
2383,"Log4j","Configurator","log4j-dev","RESOLVED","WONTFIX","BasicConfigurator's deprecated method : enableAll()","2004-11-16 19:05:38"
2411,"Log4j","Appender","log4j-dev","RESOLVED","INVALID","Duplication during logging","2005-03-20 17:06:12"
2498,"Log4j","Appender","log4j-dev","RESOLVED","FIXED","WriterAppender doesn't flush footer output","2004-11-16 19:05:38"
2558,"Log4j","Appender","log4j-dev","RESOLVED","WORKSFORME","FileAppender requires / for proper useage.","2004-11-16 19:05:38"
2579,"Log4j","Other","log4j-dev","RESOLVED","LATER","error at overwritten category.","2004-11-16 19:05:38"
2586,"Log4j","Layout","log4j-dev","RESOLVED","INVALID","Netscpe JRE-Plugin SSL BeanInfo not found problem","2005-03-20 17:06:12"
2686,"Log4j","Appender","log4j-dev","RESOLVED","LATER","DailyRollingFileAppender with max file size","2004-11-16 19:05:38"
2688,"Log4j","Appender","log4j-dev","RESOLVED","LATER","No Such Method Error","2004-11-16 19:05:38"
2690,"Log4j","Configurator","log4j-dev","RESOLVED","INVALID","DOMConfigurator cannot be compiled (org.w3c)","2004-11-16 19:05:38"
2701,"Log4j","Appender","log4j-dev","RESOLVED","FIXED","WriterAppender does not allow logging with other character encoding","2004-11-16 19:05:38"
2726,"Log4j","Other","log4j-dev","RESOLVED","FIXED","[doc bug] incorrect explanation of priority level in FAQ","2004-11-16 19:05:38"
2791,"Log4j","Appender","log4j-dev","RESOLVED","FIXED","RollingFileAppender should provide a rollover() on startup option","2004-11-16 19:05:38"
2844,"Log4j","Appender","log4j-dev","RESOLVED","DUPLICATE","RollingFileAppender requires JVM 1.2","2004-11-16 19:05:38"
2953,"Log4j","Appender","log4j-dev","RESOLVED","LATER","RollingFileAppender loses log files","2005-03-20 17:06:12"
2976,"Log4j","Configurator","log4j-dev","RESOLVED","FIXED","Defaultvalues in properties during configuration not found","2004-11-16 19:05:38"
3008,"Log4j","Appender","log4j-dev","RESOLVED","WORKSFORME","Log4j stopped rolling log while program was running.","2005-03-20 17:06:12"
3023,"Log4j","Other","log4j-dev","RESOLVED","FIXED","Documentation change - JUnit version dependency","2004-11-16 19:05:38"
3058,"Log4j","Configurator","log4j-dev","RESOLVED","REMIND","DOMConfigurator File Sharing Access log4j.dtd","2005-03-20 17:06:12"
3071,"Log4j","Other","log4j-dev","RESOLVED","FIXED","syntax error in explanatory java code","2004-11-16 19:05:38"
3091,"Log4j","Appender","log4j-dev","RESOLVED","INVALID","computeCheckPeriod() doesn't work.","2005-03-20 17:06:12"
3095,"Log4j","Configurator","log4j-dev","RESOLVED","FIXED","Need DOMConfigurator.doConfigure(Element, Hierarchy)","2004-11-16 19:05:38"
3105,"Log4j","Appender","log4j-dev","RESOLVED","WORKSFORME","DailyRollingFileAppender not working correctly on NT","2005-03-20 17:06:12"
3135,"Log4j","Configurator","log4j-dev","RESOLVED","INVALID","Problems with appenders/configuration files?","2004-11-16 19:05:38"
3145,"Log4j","Appender","log4j-dev","RESOLVED","INVALID","FileAppender.setFile(String file)","2005-03-20 17:06:12"
3149,"Log4j","Other","log4j-dev","RESOLVED","WORKSFORME","1.1.3 Deployment problem","2004-11-16 19:05:38"
3150,"Log4j","Configurator","log4j-dev","RESOLVED","INVALID","additivity prefix confusing","2004-11-16 19:05:38"
3163,"Log4j","Appender","log4j-dev","RESOLVED","REMIND","ServletLogAppender contrib","2004-11-16 19:05:38"
3186,"Log4j","Configurator","log4j-dev","RESOLVED","INVALID","Error in processing configuration file","2004-11-16 19:05:38"
3284,"Log4j","Configurator","log4j-dev","RESOLVED","FIXED","Class org.apache.log4j.config.PropertySetterException not in Log4j-Core.jar","2004-11-16 19:05:38"
3535,"Log4j","Appender","log4j-dev","RESOLVED","FIXED","Modify JMSAppender to allow persistent messages.","2004-11-16 19:05:38"
3607,"Log4j","Appender","log4j-dev","RESOLVED","FIXED","(log4j 1.1.3) RollingFileAppenderBeanInfo will not compile on JKD1.1","2005-03-20 17:06:12"
3610,"Log4j","Configurator","log4j-dev","RESOLVED","FIXED","The XPriority example is incorrect","2005-03-20 17:06:12"
3615,"Log4j","Other","log4j-dev","RESOLVED","FIXED","Deprecation in the OptionHandler interface","2005-03-20 17:06:12"
3715,"Log4j","Appender","log4j-dev","RESOLVED","INVALID","ConsoleAppender does not work under WebLogic","2005-03-20 17:06:12"
3719,"Log4j","Appender","log4j-dev","RESOLVED","INVALID","Using appender for two categories duplicates output","2004-11-16 19:05:38"
3742,"Log4j","Other","log4j-dev","RESOLVED","WONTFIX","org.apache.log4j.Category.getChainedPriority() : performance leak?","2004-11-16 19:05:38"
3746,"Log4j","Configurator","log4j-dev","RESOLVED","INVALID","Problem using subclasses of Category","2004-11-16 19:05:38"
3786,"Log4j","Other","log4j-dev","RESOLVED","LATER","Add Category.getInstance() variant that finds class name off stack trace","2004-11-16 19:05:38"
3794,"Log4j","Other","log4j-dev","RESOLVED","FIXED","TRACE priority(i.e. priority lower than DEBUG)  in XTest.java example does not work.","2005-03-20 17:06:12"
3853,"Log4j","Appender","log4j-dev","RESOLVED","FIXED","Javadoc. BasicConfigurator.configure() uses ConsoleAppender not FileAppender","2004-11-16 19:05:38"
3915,"Log4j","Appender","log4j-dev","RESOLVED","INVALID","AsyncAppender ""eats"" location information","2004-11-16 19:05:38"
3933,"Log4j","Other","log4j-dev","RESOLVED","FIXED","SocketServer Poor Performance could be improved significantly.","2004-11-16 19:05:38"
3976,"Log4j","Layout","log4j-dev","RESOLVED","INVALID","AsynAppender layout for %C{2} (%F:%L)  does not work","2005-03-20 17:06:12"
4024,"Log4j","Configurator","log4j-dev","RESOLVED","WONTFIX","Configuration of the Source of NTEventLogAppender","2005-03-20 17:06:12"
4098,"Log4j","Other","log4j-dev","RESOLVED","FIXED","Setting name for the FileWatchdog thread","2011-12-25 22:18:56"
4122,"Log4j","Configurator","log4j-dev","RESOLVED","FIXED","variable substitution doesn't support recursive substitutions.","2004-11-16 19:05:38"
4301,"Log4j","Other","log4j-dev","RESOLVED","FIXED","Category.getInstance(String, CategoryFactory) returns incorrect Category if there is a name clash","2005-03-20 17:06:12"
4378,"Log4j","Other","log4j-dev","RESOLVED","FIXED","Misspelled word in FAQ","2004-11-16 19:05:38"
4561,"Log4j","Other","log4j-dev","RESOLVED","INVALID","Log4J threads don't seem to terminate incase of the file permissions are not sufficient","2004-12-13 09:02:15"
4636,"Log4j","Other","log4j-dev","RESOLVED","INVALID","multi thread logging","2004-11-16 19:05:38"
4746,"Log4j","Appender","log4j-dev","RESOLVED","INVALID","NTAppender does not use the layout speciifed in the properties file","2005-03-20 17:06:12"
4756,"Log4j","Appender","log4j-dev","RESOLVED","WONTFIX","Add controls to NT Event Log appender for event #, user","2005-03-20 17:06:12"
4802,"Log4j","Other","log4j-dev","RESOLVED","WONTFIX","Not Serializable in Log4J 1.1.3","2005-03-20 17:06:12"
4815,"Log4j","Configurator","log4j-dev","RESOLVED","FIXED","PropertySetter ignores default properties in the java.util.Properties object sent to setProperties(java.util.Properties, String)","2004-11-16 19:05:38"
4861,"Log4j","Appender","log4j-dev","RESOLVED","INVALID","log4j:ERROR Failed to flush writer","2010-05-25 17:52:05"
4979,"Log4j","Other","log4j-dev","RESOLVED","FIXED","Docs issue and .ZIP missing files.","2004-11-16 19:05:38"
5021,"Log4j","Appender","log4j-dev","RESOLVED","INVALID","version 1.1.3 Bug in TempFileAppender","2004-11-16 19:05:38"
5022,"Log4j","Other","log4j-dev","RESOLVED","INVALID","Bug in example MyCategory min method","2004-11-16 19:05:38"
5024,"Log4j","Other","log4j-dev","RESOLVED","INVALID","TracePrintWriter is missing .. from package  org.apache.log4j.helpers","2004-11-16 19:05:38"
5164,"Log4j","Other","log4j-dev","RESOLVED","FIXED","What is the exact name of this product?","2004-11-16 19:05:38"
5211,"Log4j","Appender","log4j-dev","RESOLVED","DUPLICATE","DailyRollingFileAppender should check renameTo result in rollOver method","2005-03-20 17:06:12"
5232,"Log4j","Configurator","log4j-dev","RESOLVED","WONTFIX","DOMConfigurator does not parse appenders if invoked with a tree fragment","2004-11-16 19:05:38"
5267,"Log4j","Configurator","log4j-dev","RESOLVED","WORKSFORME","ProperteryConfigurator thows SAXException","2004-11-16 19:05:38"
5341,"Log4j","Other","log4j-dev","RESOLVED","WORKSFORME","All Threads' NDCs are displayed when Thread is 0","2005-03-20 17:06:12"
5393,"Log4j","Appender","log4j-dev","RESOLVED","LATER","DailyRollingFileAppender should have rolling for n hrs","2005-03-20 17:06:12"
5444,"Log4j","Appender","log4j-dev","RESOLVED","FIXED","AsyncAppender throws NullPointerException","2004-11-16 19:05:38"
5485,"Log4j","Layout","log4j-dev","RESOLVED","FIXED","XMLLayout: CR/LF is omitted when dumping throwable","2004-11-16 19:05:38"
5657,"Log4j","Appender","log4j-dev","RESOLVED","INVALID","No Filenameconversion","2005-03-20 17:06:12"
5669,"Log4j","Appender","log4j-dev","RESOLVED","INVALID","SMTPAppender: no stack trace when called from a servlet","2005-03-20 17:06:12"
5695,"Log4j","Other","log4j-dev","RESOLVED","INVALID","Can't use log4j from two servlet contexts","2005-03-20 17:06:12"
5798,"Log4j","Layout","log4j-dev","RESOLVED","WONTFIX","Missing file location information from log file","2004-11-16 19:05:38"
5839,"Log4j","Other","log4j-dev","RESOLVED","INVALID","NONE is not supported","2005-03-20 17:06:12"
5841,"Log4j","Other","log4j-dev","RESOLVED","INVALID","Not possible with more than one category per file/module","2005-03-20 17:06:12"
5846,"Log4j","Other","log4j-dev","RESOLVED","INVALID","SocketAppender does not reconnect!!","2005-03-20 17:06:12"
5856,"Log4j","Other","log4j-dev","RESOLVED","LATER","Need for several viewers/listeners...SocketAppender architecture....","2005-03-20 17:06:12"
5882,"Log4j","Configurator","log4j-dev","RESOLVED","WORKSFORME","Log4j does not free the appenders and resources when running in Visual Age","2005-03-20 17:06:12"
5932,"Log4j","Other","log4j-dev","RESOLVED","FIXED","MDC is not working with AsyncAppender","2004-11-16 19:05:38"
5956,"Log4j","Appender","log4j-dev","RESOLVED","FIXED","JVM core dump at LocationInfo","2004-11-16 19:05:38"
5999,"Log4j","Other","log4j-dev","RESOLVED","REMIND","Need a FAQ for -Dlog4j.configuration","2004-11-16 19:05:38"
6030,"Log4j","Other","log4j-dev","RESOLVED","FIXED","1.1.3 javadoc pages are actually 1.2 alpha 7","2004-11-16 19:05:38"
6034,"Log4j","Appender","log4j-dev","RESOLVED","INVALID","SocketAppender stops logging of its start up class","2005-03-20 17:06:12"
6077,"Log4j","Other","log4j-dev","RESOLVED","WONTFIX","readPriority() method in org.apache.log4j.spi.LoggingEvent.java throws NoSuchMethodException","2005-03-20 17:06:12"
6210,"Log4j","Configurator","log4j-dev","RESOLVED","FIXED","log4j in weblogic","2004-11-16 19:05:38"
6532,"Log4j","Appender","log4j-dev","RESOLVED","WORKSFORME","DailyRollingFileAppender not appending to a new file","2004-11-16 19:05:38"
6559,"Log4j","Appender","log4j-dev","RESOLVED","FIXED","org.apache.log4j.spi.CategoryFactory.ava has incorrect extention","2004-11-16 19:05:38"
6674,"Log4j","Appender","log4j-dev","RESOLVED","INVALID","Rolling file appender error","2005-03-20 17:06:12"
6718,"Log4j","Configurator","log4j-dev","RESOLVED","WORKSFORME","PropertyConfigurator fails to configure loggers in 1.2 beta 3","2004-11-16 19:05:38"
6773,"Log4j","Other","log4j-dev","RESOLVED","INVALID","LevelMatchFilter does not work in 1.2beta3","2004-11-16 19:05:38"
6860,"Log4j","Appender","log4j-dev","RESOLVED","INVALID","Filtering in Websphere 3.5.5","2004-11-16 19:05:38"
6953,"Log4j","Configurator","log4j-dev","RESOLVED","WONTFIX","OptionConverter Exception in Class instantiation for renderers","2004-11-16 19:05:38"
6970,"Log4j","Appender","log4j-dev","RESOLVED","WORKSFORME","shutdown does not close files under AsyncAppender","2005-03-20 17:06:12"
7042,"Log4j","Appender","log4j-dev","RESOLVED","WONTFIX","The NullAppender class is missing from the log4j.jar and log4j-core.jar jar files.","2005-03-20 17:06:12"
7085,"Log4j","Other","log4j-dev","RESOLVED","INVALID","Category ""root"" not Category.getRoot()","2004-11-16 19:05:38"
7113,"Log4j","Other","log4j-dev","RESOLVED","WONTFIX","Class.forName causes problems","2005-03-20 17:06:12"
7260,"Log4j","Configurator","log4j-dev","RESOLVED","FIXED","file handle not being release after reading configuration file","2004-11-16 19:05:38"
7304,"Log4j","Other","log4j-dev","RESOLVED","INVALID","Beta 4 - Clicking on examples yields 404","2004-11-16 19:05:38"
7451,"Log4j","Appender","log4j-dev","RESOLVED","INVALID","Multiple RollingFileAppenders using the same file don't create backups","2005-03-20 17:06:12"
7484,"Log4j","Configurator","log4j-dev","RESOLVED","INVALID","ignoring configuration file during servlet startup","2004-11-16 19:05:38"
7504,"Log4j","Other","log4j-dev","RESOLVED","FIXED","PatternLayout javadoc needs to be updated to document new MDC pattern converter.","2004-11-16 19:05:38"
7515,"Log4j","Appender","log4j-dev","RESOLVED","DUPLICATE","DailyRollingFileAppender wrong rollover type","2004-11-16 19:05:38"
7516,"Log4j","Appender","log4j-dev","RESOLVED","REMIND","DailyRollingFileAppender support for TimeZones","2004-11-16 19:05:38"
7550,"Log4j","Appender","log4j-dev","RESOLVED","FIXED","DailyRollingFileAppender defaults to HALF_DAY rotation when you specify TOP_OF_DAY rotation","2004-11-16 19:05:38"
7593,"Log4j","Layout","log4j-dev","RESOLVED","FIXED","Constructor method names <init> create non well-formed XML output","2005-03-20 17:06:12"
7678,"Log4j","Appender","log4j-dev","RESOLVED","INVALID","if log file is deleted, data will be lost until defined log size has been reached","2004-12-10 10:39:32"
7793,"Log4j","Configurator","log4j-dev","RESOLVED","FIXED","propertyconfigurator leaves file in use after reading under aix","2004-11-16 19:05:39"
7943,"Log4j","Other","log4j-dev","RESOLVED","INVALID","getParent() is not accepted","2004-11-16 19:05:39"
7947,"Log4j","Appender","log4j-dev","RESOLVED","WONTFIX","for all FileAppenders configured in log4j configuration a new empty file will be created","2004-11-16 19:05:39"
7948,"Log4j","Layout","log4j-dev","RESOLVED","FIXED","Layout & Subclasses: getFooter never called","2004-12-15 08:35:05"
7949,"Log4j","Appender","log4j-dev","RESOLVED","INVALID","mix data inside files","2004-11-16 19:05:39"
8021,"Log4j","Configurator","log4j-dev","RESOLVED","INVALID","log4j doesn't initialize properly under Tomcat 4.0.1","2004-11-16 19:05:39"
8146,"Log4j","Configurator","log4j-dev","RESOLVED","WONTFIX","Support more flexible XML configuration","2005-03-20 17:06:12"
8201,"Log4j","Appender","log4j-dev","RESOLVED","WONTFIX","setFile(String, boolean) no more available in RollingFileAppender","2004-11-16 19:05:39"
8400,"Log4j","Other","log4j-dev","RESOLVED","FIXED","JDBCAppender not found in log4j-1.2rc1.jar","2005-03-20 17:06:12"
8401,"Log4j","Appender","log4j-dev","RESOLVED","FIXED","JDBCAppender not using LogLog","2004-11-16 19:05:39"
8494,"Log4j","Configurator","log4j-dev","RESOLVED","INVALID","configure multiple level for one logger","2004-11-16 19:05:39"
8497,"Log4j","Appender","log4j-dev","RESOLVED","INVALID","AppenderSkeleton subclasses still message getOptionStrings() and setOptions(String, String)","2004-11-16 19:05:39"
8498,"Log4j","Other","log4j-dev","RESOLVED","FIXED","StressCategory.checkCorrectness(int) calls invalid method on Category.","2004-11-16 19:05:39"
8499,"Log4j","Other","log4j-dev","RESOLVED","FIXED","StressCategory.createLoop(int) calls method on LoggerRepository Interface which doesn't exist.","2004-11-16 19:05:39"
